title,plot,genres,keywords,rating,num_votes,release_date
Man of Steel,"A young boy learns that he has extraordinary powers and is not of this earth. As a young man, he journeys to discover where he came from and what he was sent here to do. But the hero in him must emerge if he is to save the world from annihilation and become the symbol of hope for all mankind.","[{""id"": 28, ""name"": ""Action""}, {""id"": 12, ""name"": ""Adventure""}, {""id"": 14, ""name"": ""Fantasy""}, {""id"": 878, ""name"": ""Science Fiction""}]","[{""id"": 83, ""name"": ""saving the world""}, {""id"": 849, ""name"": ""dc comics""}, {""id"": 9715, ""name"": ""superhero""}, {""id"": 9717, ""name"": ""based on comic book""}, {""id"": 10761, ""name"": ""superhuman""}, {""id"": 14909, ""name"": ""alien invasion""}, {""id"": 161184, ""name"": ""reboot""}, {""id"": 163455, ""name"": ""super powers""}, {""id"": 229266, ""name"": ""dc extended universe""}]",6.5,6359,2013-06-12
Pacific Rim,"When legions of monstrous creatures, known as Kaiju, started rising from the sea, a war began that would take millions of lives and consume humanity's resources for years on end. To combat the giant Kaiju, a special type of weapon was devised: massive robots, called Jaegers, which are controlled simultaneously by two pilots whose minds are locked in a neural bridge. But even the Jaegers are proving nearly defenseless in the face of the relentless Kaiju. On the verge of defeat, the forces defending mankind have no choice but to turn to two unlikely heroes—a washed-up former pilot (Charlie Hunnam) and an untested trainee (Rinko Kikuchi)—who are teamed to drive a legendary but seemingly obsolete Jaeger from the past. Together, they stand as mankind's last hope against the mounting apocalypse.","[{""id"": 28, ""name"": ""Action""}, {""id"": 878, ""name"": ""Science Fiction""}, {""id"": 12, ""name"": ""Adventure""}]","[{""id"": 4565, ""name"": ""dystopia""}, {""id"": 10891, ""name"": ""giant robot""}, {""id"": 11100, ""name"": ""giant monster""}, {""id"": 12332, ""name"": ""apocalypse""}, {""id"": 156395, ""name"": ""imax""}, {""id"": 179431, ""name"": ""duringcreditsstinger""}, {""id"": 209714, ""name"": ""3d""}]",6.7,4794,2013-07-11
The Amazing Spider-Man 2,"For Peter Parker, life is busy. Between taking out the bad guys as Spider-Man and spending time with the person he loves, Gwen Stacy, high school graduation cannot come quickly enough. Peter has not forgotten about the promise he made to Gwen’s father to protect her by staying away, but that is a promise he cannot keep. Things will change for Peter when a new villain, Electro, emerges, an old friend, Harry Osborn, returns, and Peter uncovers new clues about his past.","[{""id"": 28, ""name"": ""Action""}, {""id"": 12, ""name"": ""Adventure""}, {""id"": 14, ""name"": ""Fantasy""}]","[{""id"": 1523, ""name"": ""obsession""}, {""id"": 8828, ""name"": ""marvel comic""}, {""id"": 9663, ""name"": ""sequel""}, {""id"": 9717, ""name"": ""based on comic book""}, {""id"": 13040, ""name"": ""electrocution""}, {""id"": 33977, ""name"": ""medical experiment""}, {""id"": 41594, ""name"": ""electricity""}, {""id"": 163455, ""name"": ""super powers""}]",6.5,4179,2014-04-16
Pitch Perfect 2,"The Bellas are back, and they are better than ever. After being humiliated in front of none other than the President of the United States of America, the Bellas are taken out of the Aca-Circuit. In order to clear their name, and regain their status, the Bellas take on a seemingly impossible task: winning an international competition no American team has ever won. In order to accomplish this monumental task, they need to strengthen the bonds of friendship and sisterhood and blow away the competition with their amazing aca-magic! With all new friends and old rivals tagging along for the trip, the Bellas can hopefully accomplish their dreams.","[{""id"": 35, ""name"": ""Comedy""}, {""id"": 10402, ""name"": ""Music""}]","[{""id"": 6027, ""name"": ""music""}, {""id"": 9663, ""name"": ""sequel""}, {""id"": 10229, ""name"": ""singer""}, {""id"": 10556, ""name"": ""male female relationship""}, {""id"": 33928, ""name"": ""audition""}, {""id"": 155939, ""name"": ""group of friends""}, {""id"": 179431, ""name"": ""duringcreditsstinger""}, {""id"": 186120, ""name"": ""singing competition""}, {""id"": 186136, ""name"": ""female musician""}, {""id"": 186147, ""name"": ""singing contest""}, {""id"": 187056, ""name"": ""woman director""}, {""id"": 209838, ""name"": ""acapella""}]",6.8,1940,2015-05-07
Maze Runner: The Scorch Trials,"Thomas and his fellow Gladers face their greatest challenge yet: searching for clues about the mysterious and powerful organization known as WCKD. Their journey takes them to the Scorch, a desolate landscape filled with unimaginable obstacles. Teaming up with resistance fighters, the Gladers take on WCKD’s vastly superior forces and uncover its shocking plans for them all.","[{""id"": 28, ""name"": ""Action""}]","[{""id"": 818, ""name"": ""based on novel""}, {""id"": 836, ""name"": ""resistance""}, {""id"": 2158, ""name"": ""maze""}, {""id"": 4458, ""name"": ""post-apocalyptic""}, {""id"": 4565, ""name"": ""dystopia""}, {""id"": 4884, ""name"": ""infection""}, {""id"": 10562, ""name"": ""on the run""}, {""id"": 10685, ""name"": ""escape""}, {""id"": 12377, ""name"": ""zombie""}, {""id"": 14527, ""name"": ""storm""}, {""id"": 14673, ""name"": ""disease""}, {""id"": 18034, ""name"": ""desert""}, {""id"": 41412, ""name"": ""sewer""}, {""id"": 162344, ""name"": ""antidote""}, {""id"": 188950, ""name"": ""corporation""}, {""id"": 188957, ""name"": ""virus""}, {""id"": 204967, ""name"": ""runner""}, {""id"": 213987, ""name"": ""city ruin""}, {""id"": 219843, ""name"": ""immunity""}]",6.4,3040,2015-09-09
Toy Story 3,"Woody, Buzz, and the rest of Andy's toys haven't been played with in years. With Andy about to go to college, the gang find themselves accidentally left at a nefarious day care center. The toys must band together to escape and return home to Andy.","[{""id"": 16, ""name"": ""Animation""}, {""id"": 10751, ""name"": ""Family""}, {""id"": 35, ""name"": ""Comedy""}]","[{""id"": 1562, ""name"": ""hostage""}, {""id"": 3616, ""name"": ""college""}, {""id"": 4290, ""name"": ""toy""}, {""id"": 5462, ""name"": ""barbie""}, {""id"": 10336, ""name"": ""animation""}, {""id"": 10685, ""name"": ""escape""}, {""id"": 33794, ""name"": ""day care""}, {""id"": 158162, ""name"": ""teddy bear""}, {""id"": 179431, ""name"": ""duringcreditsstinger""}, {""id"": 187065, ""name"": ""toy comes to life""}, {""id"": 209386, ""name"": ""personification""}, {""id"": 209387, ""name"": ""inanimate objects coming to life""}, {""id"": 224516, ""name"": ""toy story""}]",7.6,4597,2010-06-16
The Secret Life of Walter Mitty,A timid magazine photo manager who lives life vicariously through daydreams embarks on a true-life adventure when a negative goes missing.,"[{""id"": 12, ""name"": ""Adventure""}, {""id"": 35, ""name"": ""Comedy""}, {""id"": 18, ""name"": ""Drama""}, {""id"": 14, ""name"": ""Fantasy""}]","[{""id"": 486, ""name"": ""himalaya""}, {""id"": 1003, ""name"": ""photographer""}, {""id"": 4620, ""name"": ""magazine""}, {""id"": 5746, ""name"": ""iceland""}, {""id"": 5779, ""name"": ""daydream""}, {""id"": 13094, ""name"": ""photograph""}, {""id"": 15097, ""name"": ""shark""}, {""id"": 18326, ""name"": ""fired from the job""}, {""id"": 33355, ""name"": ""skateboard""}, {""id"": 173276, ""name"": ""dreamer""}, {""id"": 182195, ""name"": ""online dating""}, {""id"": 188841, ""name"": ""daydreaming""}]",7.0,3144,2013-12-18
Warcraft,"The peaceful realm of Azeroth stands on the brink of war as its civilization faces a fearsome race of invaders: orc warriors fleeing their dying home to colonize another. As a portal opens to connect the two worlds, one army faces destruction and the other faces extinction. From opposing sides, two heroes are set on a collision course that will decide the fate of their family, their people, and their home.","[{""id"": 28, ""name"": ""Action""}, {""id"": 12, ""name"": ""Adventure""}, {""id"": 14, ""name"": ""Fantasy""}]","[{""id"": 282, ""name"": ""video game""}, {""id"": 603, ""name"": ""elves""}, {""id"": 606, ""name"": ""orcs""}, {""id"": 2343, ""name"": ""magic""}, {""id"": 3713, ""name"": ""chase""}, {""id"": 9717, ""name"": ""based on comic book""}, {""id"": 10821, ""name"": ""sorcerer""}, {""id"": 14946, ""name"": ""fictional war""}, {""id"": 41645, ""name"": ""based on video game""}, {""id"": 177912, ""name"": ""wizard""}, {""id"": 189113, ""name"": ""fictional language""}, {""id"": 211674, ""name"": ""muscles""}, {""id"": 228295, ""name"": ""orc""}, {""id"": 234213, ""name"": ""sword and sorcery""}]",6.3,2268,2016-05-25
Insurgent,Beatrice Prior must confront her inner demons and continue her fight against a powerful alliance which threatens to tear her society apart.,"[{""id"": 12, ""name"": ""Adventure""}, {""id"": 878, ""name"": ""Science Fiction""}, {""id"": 53, ""name"": ""Thriller""}]","[{""id"": 818, ""name"": ""based on novel""}, {""id"": 2020, ""name"": ""revolution""}, {""id"": 4565, ""name"": ""dystopia""}, {""id"": 9663, ""name"": ""sequel""}, {""id"": 162988, ""name"": ""dystopic future""}, {""id"": 206298, ""name"": ""young adult""}, {""id"": 209714, ""name"": ""3d""}, {""id"": 211389, ""name"": ""divergent""}]",6.2,3829,2015-03-18
Brooklyn,"In 1950s Ireland and New York, young Ellis Lacey has to choose between two men and two countries.","[{""id"": 18, ""name"": ""Drama""}, {""id"": 10749, ""name"": ""Romance""}]","[{""id"": 128, ""name"": ""love triangle""}, {""id"": 818, ""name"": ""based on novel""}, {""id"": 1007, ""name"": ""homesickness""}, {""id"": 1950, ""name"": ""vororte""}, {""id"": 3799, ""name"": ""ship""}, {""id"": 5890, ""name"": ""community""}, {""id"": 6038, ""name"": ""marriage""}, {""id"": 11935, ""name"": ""working class""}, {""id"": 12390, ""name"": ""boarding house""}, {""id"": 14985, ""name"": ""ireland""}, {""id"": 41523, ""name"": ""brooklyn new york city""}, {""id"": 189092, ""name"": ""journey""}, {""id"": 196521, ""name"": ""dual life""}, {""id"": 206160, ""name"": ""irish immigrant""}, {""id"": 208611, ""name"": ""1950s""}]",7.2,1213,2015-10-20
Alice Through the Looking Glass,"In the sequel to Tim Burton's ""Alice in Wonderland"", Alice Kingsleigh returns to Underland and faces a new adventure in saving the Mad Hatter.","[{""id"": 14, ""name"": ""Fantasy""}]","[{""id"": 818, ""name"": ""based on novel""}, {""id"": 1507, ""name"": ""clock""}, {""id"": 2011, ""name"": ""queen""}, {""id"": 9663, ""name"": ""sequel""}, {""id"": 12552, ""name"": ""alice in wonderland""}, {""id"": 177895, ""name"": ""dark fantasy""}, {""id"": 203699, ""name"": ""mad hatter""}, {""id"": 209714, ""name"": ""3d""}]",6.5,1725,2016-05-25
The Longest Ride,The lives of a young couple intertwine with a much older man as he reflects back on a lost love while he's trapped in an automobile crash.,"[{""id"": 18, ""name"": ""Drama""}, {""id"": 10749, ""name"": ""Romance""}]","[{""id"": 818, ""name"": ""based on novel""}, {""id"": 9082, ""name"": ""art student""}, {""id"": 155291, ""name"": ""cowboy""}, {""id"": 158591, ""name"": ""injury""}, {""id"": 190078, ""name"": ""bull riding""}, {""id"": 191100, ""name"": ""romantic drama""}, {""id"": 206298, ""name"": ""young adult""}]",7.3,1064,2015-04-09
Silver Linings Playbook,"After spending eight months in a mental institution, a former teacher moves back in with his parents and tries to reconcile with his ex-wife.","[{""id"": 18, ""name"": ""Drama""}, {""id"": 35, ""name"": ""Comedy""}, {""id"": 10749, ""name"": ""Romance""}]","[{""id"": 246, ""name"": ""dancing""}, {""id"": 276, ""name"": ""philadelphia""}, {""id"": 795, ""name"": ""running""}, {""id"": 818, ""name"": ""based on novel""}, {""id"": 894, ""name"": ""depression""}, {""id"": 3344, ""name"": ""letter""}, {""id"": 6054, ""name"": ""friendship""}, {""id"": 10226, ""name"": ""neighbor""}, {""id"": 41329, ""name"": ""mental illness""}, {""id"": 155816, ""name"": ""ex-wife""}, {""id"": 162970, ""name"": ""institutionalization""}, {""id"": 189447, ""name"": ""bipolar""}, {""id"": 189881, ""name"": ""philadelphia eagles""}]",6.9,4742,2012-09-08
Drive,A Hollywood stunt performer who moonlights as a wheelman for criminals discovers that a contract has been put on him after a heist gone wrong.,"[{""id"": 18, ""name"": ""Drama""}, {""id"": 28, ""name"": ""Action""}, {""id"": 53, ""name"": ""Thriller""}, {""id"": 80, ""name"": ""Crime""}]","[{""id"": 5956, ""name"": ""stuntman""}, {""id"": 8636, ""name"": ""blood splatter""}, {""id"": 10183, ""name"": ""independent film""}, {""id"": 11148, ""name"": ""police chase""}, {""id"": 14687, ""name"": ""extreme violence""}, {""id"": 14819, ""name"": ""violence""}, {""id"": 15483, ""name"": ""car chase""}, {""id"": 47021, ""name"": ""bullet""}, {""id"": 154892, ""name"": ""head stomp""}, {""id"": 159700, ""name"": ""getaway""}, {""id"": 167352, ""name"": ""crime lord""}, {""id"": 181324, ""name"": ""existentialism""}, {""id"": 226754, ""name"": ""silent protagonist""}, {""id"": 234367, ""name"": ""great soundtrack""}]",7.4,3725,2011-08-06
The Secret Life of Pets,"The quiet life of a terrier named Max is upended when his owner takes in Duke, a stray whom Max instantly dislikes.","[{""id"": 16, ""name"": ""Animation""}, {""id"": 10751, ""name"": ""Family""}]","[{""id"": 2551, ""name"": ""pet""}, {""id"": 3208, ""name"": ""bunny""}, {""id"": 11500, ""name"": ""anthropomorphism""}, {""id"": 15162, ""name"": ""dog""}, {""id"": 18165, ""name"": ""animal""}, {""id"": 33347, ""name"": ""apartment building""}, {""id"": 41412, ""name"": ""sewer""}, {""id"": 158225, ""name"": ""terrier""}, {""id"": 168346, ""name"": ""manhattan, new york city""}, {""id"": 204052, ""name"": ""rodent""}, {""id"": 229051, ""name"": ""mongrel""}]",5.9,3462,2016-06-18
X-Men: First Class,"Before Charles Xavier and Erik Lensherr took the names Professor X and Magneto, they were two young men discovering their powers for the first time. Before they were arch-enemies, they were closest of friends, working together with other mutants (some familiar, some new), to stop the greatest threat the world has ever known.","[{""id"": 28, ""name"": ""Action""}, {""id"": 878, ""name"": ""Science Fiction""}, {""id"": 12, ""name"": ""Adventure""}]","[{""id"": 591, ""name"": ""cia""}, {""id"": 1852, ""name"": ""mutant""}, {""id"": 1960, ""name"": ""mine""}, {""id"": 8828, ""name"": ""marvel comic""}, {""id"": 9715, ""name"": ""superhero""}, {""id"": 9717, ""name"": ""based on comic book""}, {""id"": 10761, ""name"": ""superhuman""}, {""id"": 12995, ""name"": ""historical fiction""}, {""id"": 18139, ""name"": ""nuclear war""}, {""id"": 181558, ""name"": ""cuban missile crisis""}, {""id"": 208731, ""name"": ""world war iii""}, {""id"": 208992, ""name"": ""1960s""}]",7.1,5181,2011-05-24
WALL·E,"WALL·E is the last robot left on an Earth that has been overrun with garbage and all humans have fled to outer space. For 700 years he has continued to try and clean up the mess, but has developed some rather interesting human-like qualities. When a ship arrives with a sleek new type of robot, WALL·E thinks he's finally found a friend and stows away on the ship when it leaves.","[{""id"": 16, ""name"": ""Animation""}, {""id"": 10751, ""name"": ""Family""}]","[{""id"": 9799, ""name"": ""romantic comedy""}]",7.8,6296,2008-06-22
13 Hours: The Secret Soldiers of Benghazi,An American Ambassador is killed during an attack at a U.S. compound in Libya as a security team struggles to make sense out of the chaos.,"[{""id"": 28, ""name"": ""Action""}, {""id"": 18, ""name"": ""Drama""}, {""id"": 36, ""name"": ""History""}, {""id"": 53, ""name"": ""Thriller""}, {""id"": 10752, ""name"": ""War""}]","[{""id"": 818, ""name"": ""based on novel""}, {""id"": 1376, ""name"": ""assault rifle""}, {""id"": 3070, ""name"": ""mercenary""}, {""id"": 5272, ""name"": ""libya""}, {""id"": 5565, ""name"": ""biography""}, {""id"": 9672, ""name"": ""based on true story""}, {""id"": 11115, ""name"": ""heroism""}, {""id"": 14601, ""name"": ""explosion""}, {""id"": 34061, ""name"": ""american abroad""}, {""id"": 34079, ""name"": ""death""}, {""id"": 209493, ""name"": ""21st century""}, {""id"": 214596, ""name"": ""cia agent""}, {""id"": 235476, ""name"": ""u.s. ambassador""}]",7.0,938,2016-01-13
The Little Prince,"Based on the best-seller book 'The Little Prince', the movie tells the story of a little girl that lives with resignation in a world where efficiency and work are the only dogmas. Everything will change when accidentally she discovers her neighbor that will tell her about the story of the Little Prince that he once met.","[{""id"": 12, ""name"": ""Adventure""}, {""id"": 16, ""name"": ""Animation""}, {""id"": 14, ""name"": ""Fantasy""}]","[{""id"": 490, ""name"": ""philosophy""}, {""id"": 3469, ""name"": ""utopia""}, {""id"": 3800, ""name"": ""airplane""}, {""id"": 4414, ""name"": ""adventure""}, {""id"": 4565, ""name"": ""dystopia""}, {""id"": 9736, ""name"": ""little boy""}, {""id"": 9825, ""name"": ""growing up""}, {""id"": 10226, ""name"": ""neighbor""}, {""id"": 10707, ""name"": ""mother daughter relationship""}, {""id"": 10873, ""name"": ""school""}, {""id"": 10938, ""name"": ""old man""}, {""id"": 12663, ""name"": ""little girl""}, {""id"": 14532, ""name"": ""crazy""}, {""id"": 15101, ""name"": ""based on children's book""}, {""id"": 170647, ""name"": ""story""}, {""id"": 180787, ""name"": ""social differences""}, {""id"": 209714, ""name"": ""3d""}]",7.6,756,2015-07-29
Unbroken,"A chronicle of the life of Louis Zamperini, an Olympic runner who was taken prisoner by Japanese forces during World War II.","[{""id"": 18, ""name"": ""Drama""}, {""id"": 10752, ""name"": ""War""}]","[{""id"": 1956, ""name"": ""world war ii""}, {""id"": 1968, ""name"": ""prisoners of war""}, {""id"": 5565, ""name"": ""biography""}, {""id"": 6075, ""name"": ""sport""}, {""id"": 6091, ""name"": ""war""}, {""id"": 10456, ""name"": ""athlete""}, {""id"": 187056, ""name"": ""woman director""}, {""id"": 208820, ""name"": ""olympic athlete""}]",7.3,1400,2014-12-25
Argo,"As the Iranian revolution reaches a boiling point, a CIA 'exfiltration' specialist concocts a risky plan to free six Americans who have found shelter at the home of the Canadian ambassador.","[{""id"": 18, ""name"": ""Drama""}, {""id"": 53, ""name"": ""Thriller""}]","[{""id"": 591, ""name"": ""cia""}, {""id"": 1157, ""name"": ""wife husband relationship""}, {""id"": 1937, ""name"": ""document""}, {""id"": 2020, ""name"": ""revolution""}, {""id"": 2430, ""name"": ""hiding place""}, {""id"": 2519, ""name"": ""canadian""}, {""id"": 2562, ""name"": ""press conference""}, {""id"": 5565, ""name"": ""biography""}, {""id"": 15292, ""name"": ""hanged man""}, {""id"": 34061, ""name"": ""american abroad""}, {""id"": 159306, ""name"": ""crane""}, {""id"": 159514, ""name"": ""subtitled scene""}, {""id"": 161996, ""name"": ""movie poster""}, {""id"": 165340, ""name"": ""based on article""}, {""id"": 185677, ""name"": ""extraction""}, {""id"": 185684, ""name"": ""iran hostage crisis""}, {""id"": 185686, ""name"": ""sweatshop""}, {""id"": 185692, ""name"": ""intelligence agent""}, {""id"": 185699, ""name"": ""film studio""}, {""id"": 185702, ""name"": ""langley virginia""}, {""id"": 208289, ""name"": ""1980s""}]",7.1,3423,2012-10-11
If I Stay,"Based on Gayle Forman's novel of the same name. ""If I Stay"" is the story of the gifted classical musician Mia and her boyfriend, Adam, an up and coming indie-rock star. Torn between two paths in life, her art or her relationship, Mia is forced to make an even starker choice between life and death when she is caught in a fatal car accident with her family one snowy morning in Oregon.","[{""id"": 18, ""name"": ""Drama""}]","[{""id"": 732, ""name"": ""coma""}, {""id"": 4048, ""name"": ""musician""}, {""id"": 10809, ""name"": ""teenage girl""}, {""id"": 13063, ""name"": ""car accident""}, {""id"": 13130, ""name"": ""teenager""}, {""id"": 184318, ""name"": ""out of body experience""}, {""id"": 193400, ""name"": ""teen drama""}, {""id"": 223438, ""name"": ""based on young adult novel""}]",7.3,1368,2014-08-21
Everest,"Inspired by the incredible events surrounding a treacherous attempt to reach the summit of the world's highest mountain, ""Everest"" documents the awe-inspiring journey of two different expeditions challenged beyond their limits by one of the fiercest snowstorms ever encountered by mankind. Their mettle tested by the harshest of elements found on the planet, the climbers will face nearly impossible obstacles as a lifelong obsession becomes a breathtaking struggle for survival.","[{""id"": 12, ""name"": ""Adventure""}, {""id"": 18, ""name"": ""Drama""}]","[{""id"": 1262, ""name"": ""mountains""}, {""id"": 3373, ""name"": ""snow storm""}, {""id"": 5827, ""name"": ""hiking""}, {""id"": 8624, ""name"": ""climbing""}, {""id"": 10794, ""name"": ""snow""}, {""id"": 34079, ""name"": ""death""}, {""id"": 156783, ""name"": ""blizzard""}, {""id"": 159212, ""name"": ""mountain climbing""}, {""id"": 185722, ""name"": ""based on true events""}, {""id"": 192779, ""name"": ""mount everest""}, {""id"": 209714, ""name"": ""3d""}]",6.7,1772,2015-09-10
How to Train Your Dragon,"As the son of a Viking leader on the cusp of manhood, shy Hiccup Horrendous Haddock III faces a rite of passage: he must kill a dragon to prove his warrior mettle. But after downing a feared dragon, he realizes that he no longer wants to destroy it, and instead befriends the beast – which he names Toothless – much to the chagrin of his warrior father","[{""id"": 14, ""name"": ""Fantasy""}, {""id"": 12, ""name"": ""Adventure""}, {""id"": 16, ""name"": ""Animation""}, {""id"": 10751, ""name"": ""Family""}]","[{""id"": 334, ""name"": ""flying""}, {""id"": 1318, ""name"": ""blacksmith""}, {""id"": 1395, ""name"": ""arena""}, {""id"": 2041, ""name"": ""island""}, {""id"": 3752, ""name"": ""night""}, {""id"": 3799, ""name"": ""ship""}, {""id"": 4613, ""name"": ""training""}, {""id"": 5331, ""name"": ""village""}, {""id"": 5774, ""name"": ""forest""}, {""id"": 5895, ""name"": ""viking""}, {""id"": 6054, ""name"": ""friendship""}, {""id"": 6253, ""name"": ""ignorance""}, {""id"": 8044, ""name"": ""flight""}, {""id"": 9109, ""name"": ""nest""}, {""id"": 12554, ""name"": ""dragon""}, {""id"": 14643, ""name"": ""battle""}, {""id"": 18543, ""name"": ""combat""}, {""id"": 172784, ""name"": ""well""}, {""id"": 192913, ""name"": ""warrior""}]",7.5,4227,2010-03-05
Steve Jobs,"Set backstage at three iconic product launches and ending in 1998 with the unveiling of the iMac, Steve Jobs takes us behind the scenes of the digital revolution to paint an intimate portrait of the brilliant man at its epicenter.","[{""id"": 18, ""name"": ""Drama""}, {""id"": 36, ""name"": ""History""}]","[{""id"": 5565, ""name"": ""biography""}, {""id"": 6104, ""name"": ""computer""}, {""id"": 15300, ""name"": ""father daughter relationship""}, {""id"": 157935, ""name"": ""apple computer""}, {""id"": 161160, ""name"": ""steve jobs""}, {""id"": 185722, ""name"": ""based on true events""}]",6.8,1573,2015-10-09
Still Alice,"Alice Howland, happily married with three grown children, is a renowned linguistics professor who starts to forget words. When she receives a devastating diagnosis, Alice and her family find their bonds tested.","[{""id"": 18, ""name"": ""Drama""}]","[{""id"": 456, ""name"": ""mother""}, {""id"": 1992, ""name"": ""professor""}, {""id"": 40895, ""name"": ""illness""}]",7.5,1104,2014-12-05
Non-Stop,"Bill Marks is a burned-out veteran of the Air Marshals service. He views the assignment not as a life-saving duty, but as a desk job in the sky. However, today's flight will be no routine trip. Shortly into the transatlantic journey from New York to London, he receives a series of mysterious text messages ordering him to have the government transfer $150 million into a secret account, or a passenger will die every 20 minutes.","[{""id"": 28, ""name"": ""Action""}, {""id"": 53, ""name"": ""Thriller""}, {""id"": 9648, ""name"": ""Mystery""}]","[{""id"": 3800, ""name"": ""airplane""}, {""id"": 10410, ""name"": ""conspiracy""}, {""id"": 12617, ""name"": ""airplane crash""}, {""id"": 15156, ""name"": ""cell phone""}, {""id"": 155238, ""name"": ""hijack""}, {""id"": 162914, ""name"": ""one night""}, {""id"": 184297, ""name"": ""mystery killer""}]",6.8,2268,2014-01-26
Despicable Me,"Villainous Gru lives up to his reputation as a despicable, deplorable and downright unlikable guy when he hatches a plan to steal the moon from the sky. But he has a tough time staying on task after three orphans land in his care.","[{""id"": 16, ""name"": ""Animation""}, {""id"": 10751, ""name"": ""Family""}]","[{""id"": 4130, ""name"": ""adoptive father""}, {""id"": 6783, ""name"": ""orphanage""}, {""id"": 7393, ""name"": ""life's dream""}, {""id"": 9823, ""name"": ""rivalry""}, {""id"": 10261, ""name"": ""stealing""}, {""id"": 10551, ""name"": ""ballet""}, {""id"": 12663, ""name"": ""little girl""}, {""id"": 13014, ""name"": ""orphan""}, {""id"": 15300, ""name"": ""father daughter relationship""}, {""id"": 156928, ""name"": ""tomboy""}, {""id"": 157499, ""name"": ""mother son relationship""}, {""id"": 160097, ""name"": ""intelligent""}, {""id"": 161155, ""name"": ""kids""}, {""id"": 179095, ""name"": ""evil doctor""}, {""id"": 179431, ""name"": ""duringcreditsstinger""}, {""id"": 190999, ""name"": ""minions""}, {""id"": 194404, ""name"": ""supervillain""}, {""id"": 209714, ""name"": ""3d""}, {""id"": 219832, ""name"": ""despicable""}, {""id"": 235459, ""name"": ""cattivissimo""}]",7.1,6478,2010-07-08
