title,plot,genres,keywords,rating,num_votes,release_date
Trainwreck,"Having thought that monogamy was never possible, a commitment-phobic career woman may have to face her fears when she meets a good guy.","[{""id"": 35, ""name"": ""Comedy""}]","[{""id"": 567, ""name"": ""alcohol""}, {""id"": 2864, ""name"": ""one-night stand""}]",5.9,1181,2015-07-17
Madagascar 3: Europe's Most Wanted,"Alex, Marty, Gloria and Melman are still trying to get back to the Big Apple and their beloved Central Park zoo, but first they need to find the penguins. When they travel to Monte Carlo, they attract the attention of Animal Control after gate crashing a party and are joined by the penguins, King Julian and Co., and the monkeys. How do a lion, zebra, hippo, giraffe, four penguins, two monkeys, three lemurs travel through Europe without attracting attention and get back to New York? They join a traveling circus. Their attempts to get back to New York are consistently hampered by the Captain of Animal Control who wants to make Alex part of her collection. Once they make it back to New York Marty, Alex, Gloria and Melman realize that they want to be part of the traveling circus.","[{""id"": 16, ""name"": ""Animation""}, {""id"": 10751, ""name"": ""Family""}]","[{""id"": 3645, ""name"": ""madagascar""}, {""id"": 209714, ""name"": ""3d""}]",6.4,1808,2012-06-06
50/50,"Inspired by a true story, a comedy centered on a 27-year-old guy who learns of his cancer diagnosis, and his subsequent struggle to beat the disease.","[{""id"": 35, ""name"": ""Comedy""}, {""id"": 18, ""name"": ""Drama""}]","[{""id"": 437, ""name"": ""painter""}, {""id"": 494, ""name"": ""father son relationship""}, {""id"": 2726, ""name"": ""therapist""}, {""id"": 10163, ""name"": ""cancer""}, {""id"": 11268, ""name"": ""psychologist""}, {""id"": 12392, ""name"": ""best friend""}, {""id"": 13005, ""name"": ""doctor""}, {""id"": 14781, ""name"": ""patient""}, {""id"": 163699, ""name"": ""vomiting""}, {""id"": 172345, ""name"": ""driver's license""}, {""id"": 220363, ""name"": ""chemotherapy""}, {""id"": 222812, ""name"": ""therapist patient relationship""}]",7.0,1261,2011-09-30
Inherent Vice,"In Los Angeles at the turn of the 1970s, drug-fueled detective Larry ""Doc"" Sportello investigates the disappearance of an ex-girlfriend.","[{""id"": 35, ""name"": ""Comedy""}, {""id"": 10749, ""name"": ""Romance""}, {""id"": 80, ""name"": ""Crime""}, {""id"": 18, ""name"": ""Drama""}, {""id"": 9648, ""name"": ""Mystery""}]","[{""id"": 818, ""name"": ""based on novel""}, {""id"": 1228, ""name"": ""1970s""}, {""id"": 11168, ""name"": ""private investigator""}, {""id"": 11492, ""name"": ""smoking marijuana""}, {""id"": 12670, ""name"": ""los angeles""}, {""id"": 208992, ""name"": ""1960s""}]",6.5,833,2014-12-25
The Peanuts Movie,"Snoopy embarks upon his greatest mission as he and his team take to the skies to pursue their arch-nemesis, while his best pal Charlie Brown begins his own epic quest back home.","[{""id"": 16, ""name"": ""Animation""}]","[{""id"": 11825, ""name"": ""based on comic strip""}, {""id"": 18035, ""name"": ""family""}, {""id"": 209714, ""name"": ""3d""}, {""id"": 210469, ""name"": ""charlie brown""}, {""id"": 221015, ""name"": ""snoopy""}]",6.5,604,2015-11-05
The Twilight Saga: Breaking Dawn - Part 2,"After the birth of Renesmee, the Cullens gather other vampire clans in order to protect the child from a false allegation that puts the family in front of the Volturi.","[{""id"": 12, ""name"": ""Adventure""}, {""id"": 14, ""name"": ""Fantasy""}, {""id"": 18, ""name"": ""Drama""}, {""id"": 10749, ""name"": ""Romance""}]","[{""id"": 3133, ""name"": ""vampire""}, {""id"": 9840, ""name"": ""romance""}, {""id"": 9990, ""name"": ""villainess""}, {""id"": 160184, ""name"": ""super strength""}, {""id"": 185616, ""name"": ""imprinting""}, {""id"": 185628, ""name"": ""cross breed""}, {""id"": 185629, ""name"": ""bloodsucker""}, {""id"": 185632, ""name"": ""grudge""}, {""id"": 185633, ""name"": ""vampire vs vampire""}, {""id"": 185644, ""name"": ""chief of police""}, {""id"": 185645, ""name"": ""dhampir""}, {""id"": 185648, ""name"": ""forks washington""}, {""id"": 185653, ""name"": ""wolf pack""}, {""id"": 185655, ""name"": ""misinformation""}, {""id"": 185668, ""name"": ""seeing the future""}, {""id"": 231407, ""name"": ""fang vamp""}]",6.1,2553,2012-11-13
Rio,"Captured by smugglers when he was just a hatchling, a macaw named Blu never learned to fly and lives a happily domesticated life in Minnesota with his human friend, Linda. Blu is thought to be the last of his kind, but when word comes that Jewel, a lone female, lives in Rio de Janeiro, Blu and Linda go to meet her. Animal smugglers kidnap Blu and Jewel, but the pair soon escape and begin a perilous adventure back to freedom -- and Linda.","[{""id"": 16, ""name"": ""Animation""}, {""id"": 12, ""name"": ""Adventure""}, {""id"": 35, ""name"": ""Comedy""}, {""id"": 10751, ""name"": ""Family""}]","[{""id"": 1161, ""name"": ""brazil""}, {""id"": 2551, ""name"": ""pet""}, {""id"": 2646, ""name"": ""bird""}, {""id"": 4344, ""name"": ""musical""}, {""id"": 7453, ""name"": ""canary""}, {""id"": 12649, ""name"": ""samba""}, {""id"": 18165, ""name"": ""animal""}, {""id"": 179431, ""name"": ""duringcreditsstinger""}, {""id"": 236475, ""name"": ""rio 1""}, {""id"": 236476, ""name"": ""r\u00edo 1""}]",6.5,2166,2011-04-03
The Pursuit of Happyness,"The true story of Christopher Gardner, who invests heavily in a device known as a 'Bone Density Scanner', only to find himself struggle to sell the product as it's just marginally better than the current technology, and much more expensive. His wife leaves him,  he loses his house, bank account and credit cards and, now forced to live out in the streets with his young son,  he's desperate to find a steady job. He takes on a job as a stockbroker but, before he can receive pay, he needs to go through 6 months of training, and must sell his devices.","[{""id"": 18, ""name"": ""Drama""}]","[{""id"": 582, ""name"": ""san francisco""}, {""id"": 641, ""name"": ""single parent""}, {""id"": 960, ""name"": ""homeless person""}, {""id"": 992, ""name"": ""bus""}, {""id"": 2346, ""name"": ""worker""}, {""id"": 2981, ""name"": ""homelessness""}, {""id"": 3640, ""name"": ""work""}, {""id"": 4636, ""name"": ""church service""}, {""id"": 4671, ""name"": ""bad luck""}, {""id"": 5565, ""name"": ""biography""}, {""id"": 10332, ""name"": ""salesman""}, {""id"": 10631, ""name"": ""stockbroker""}]",7.7,2525,2006-12-14
The Mortal Instruments: City of Bones,"In New York City, Clary Fray, a seemingly ordinary teenager, learns that she is descended from a line of Shadowhunters — half-angel warriors who protect humanity from evil forces. After her mother disappears, Clary joins forces with a group of Shadowhunters and enters Downworld, an alternate realm filled with demons, vampires, and a host of other creatures. Clary and her companions must find and protect an ancient cup that holds the key to her mother's future.","[{""id"": 28, ""name"": ""Action""}, {""id"": 12, ""name"": ""Adventure""}, {""id"": 18, ""name"": ""Drama""}, {""id"": 9648, ""name"": ""Mystery""}, {""id"": 10749, ""name"": ""Romance""}, {""id"": 14, ""name"": ""Fantasy""}]","[{""id"": 290, ""name"": ""angel""}, {""id"": 3133, ""name"": ""vampire""}, {""id"": 12564, ""name"": ""werewolf""}, {""id"": 157667, ""name"": ""warlock""}, {""id"": 186420, ""name"": ""downworlder""}, {""id"": 186423, ""name"": ""shadowhunter""}, {""id"": 186425, ""name"": ""demon hunter""}, {""id"": 223438, ""name"": ""based on young adult novel""}]",6.2,1602,2013-08-21
Project X,"Three high school seniors throw a party to make a name for themselves. As the night progresses, things spiral out of control as word of the party spreads.","[{""id"": 35, ""name"": ""Comedy""}, {""id"": 80, ""name"": ""Crime""}]","[{""id"": 2016, ""name"": ""vandalism""}, {""id"": 6270, ""name"": ""high school""}, {""id"": 8181, ""name"": ""swimming pool""}, {""id"": 8508, ""name"": ""party""}, {""id"": 11870, ""name"": ""teen movie""}, {""id"": 13130, ""name"": ""teenager""}, {""id"": 15162, ""name"": ""dog""}, {""id"": 33910, ""name"": ""high school student""}, {""id"": 160517, ""name"": ""fake documentary""}, {""id"": 171134, ""name"": ""sex doll""}, {""id"": 182145, ""name"": ""lime""}, {""id"": 182147, ""name"": ""underwater photography""}, {""id"": 182148, ""name"": ""bouncy castle""}, {""id"": 182163, ""name"": ""flash grenade""}]",6.5,1564,2012-03-01
Casino Royale,"Le Chiffre, a banker to the world's terrorists, is scheduled to participate in a high-stakes poker game in Montenegro, where he intends to use his winnings to establish his financial grip on the terrorist market. M sends Bond – on his maiden mission as a 00 Agent – to attend this game and prevent Le Chiffre from winning. With the help of Vesper Lynd and Felix Leiter, Bond enters the most important poker game in his already dangerous career.","[{""id"": 12, ""name"": ""Adventure""}, {""id"": 28, ""name"": ""Action""}, {""id"": 53, ""name"": ""Thriller""}]","[{""id"": 131, ""name"": ""italy""}, {""id"": 383, ""name"": ""poker""}, {""id"": 585, ""name"": ""casino""}, {""id"": 949, ""name"": ""terrorist""}, {""id"": 3515, ""name"": ""banker""}, {""id"": 10594, ""name"": ""money""}, {""id"": 10609, ""name"": ""free running""}, {""id"": 13006, ""name"": ""torture""}, {""id"": 156095, ""name"": ""british secret service""}, {""id"": 206125, ""name"": ""montenegro""}]",7.3,3855,2006-11-14
The Bourne Ultimatum,"Bourne is brought out of hiding once again by reporter Simon Ross who is trying to unveil Operation Blackbriar, an upgrade to Project Treadstone, in a series of newspaper columns. Information from the reporter stirs a new set of memories, and Bourne must finally uncover his dark past while dodging The Company's best efforts to eradicate him.","[{""id"": 28, ""name"": ""Action""}, {""id"": 18, ""name"": ""Drama""}, {""id"": 9648, ""name"": ""Mystery""}, {""id"": 53, ""name"": ""Thriller""}]","[{""id"": 90, ""name"": ""paris""}, {""id"": 417, ""name"": ""corruption""}, {""id"": 744, ""name"": ""madrid""}, {""id"": 782, ""name"": ""assassin""}, {""id"": 818, ""name"": ""based on novel""}, {""id"": 1295, ""name"": ""europe""}, {""id"": 3246, ""name"": ""prosecution""}, {""id"": 3851, ""name"": ""dangerous""}, {""id"": 3864, ""name"": ""false identity""}, {""id"": 4087, ""name"": ""revelation""}, {""id"": 6086, ""name"": ""government""}, {""id"": 6110, ""name"": ""weapon""}, {""id"": 6710, ""name"": ""interpol""}, {""id"": 9663, ""name"": ""sequel""}, {""id"": 10410, ""name"": ""conspiracy""}, {""id"": 10950, ""name"": ""shootout""}, {""id"": 11134, ""name"": ""espionage""}, {""id"": 14735, ""name"": ""motorcycle""}, {""id"": 14819, ""name"": ""violence""}, {""id"": 14967, ""name"": ""foot chase""}, {""id"": 18269, ""name"": ""moskow""}, {""id"": 164148, ""name"": ""dark past""}, {""id"": 185702, ""name"": ""langley virginia""}, {""id"": 187844, ""name"": ""flashback""}, {""id"": 226521, ""name"": ""chase on the roof""}, {""id"": 226522, ""name"": ""security leak""}]",7.3,2888,2007-08-03
The Lone Ranger,"The Texas Rangers chase down a gang of outlaws led by Butch Cavendish, but the gang ambushes the Rangers, seemingly killing them all. One survivor is found, however, by an American Indian named Tonto, who nurses him back to health. The Ranger, donning a mask and riding a white stallion named Silver, teams up with Tonto to bring the unscrupulous gang and others of that ilk to justice.","[{""id"": 28, ""name"": ""Action""}, {""id"": 12, ""name"": ""Adventure""}, {""id"": 37, ""name"": ""Western""}]","[{""id"": 1556, ""name"": ""texas""}, {""id"": 2673, ""name"": ""horse""}, {""id"": 5385, ""name"": ""survivor""}, {""id"": 5901, ""name"": ""texas ranger""}, {""id"": 9104, ""name"": ""partner""}, {""id"": 9503, ""name"": ""outlaw""}, {""id"": 10685, ""name"": ""escape""}, {""id"": 10909, ""name"": ""lawyer""}, {""id"": 13008, ""name"": ""train""}, {""id"": 178867, ""name"": ""lone ranger""}, {""id"": 179419, ""name"": ""comanche""}, {""id"": 222787, ""name"": ""the lone ranger""}, {""id"": 228232, ""name"": ""tonto""}]",5.9,2311,2013-07-03
The Boy in the Striped Pyjamas,"When his family moves from their home in Berlin to a strange new house in Poland, young Bruno befriends Shmuel, a boy who lives on the other side of the fence where everyone seems to be wearing striped pajamas. Unaware of Shmuel's fate as a Jewish prisoner or the role his own Nazi father plays in his imprisonment, Bruno embarks on a dangerous journey inside the camp's walls.","[{""id"": 10752, ""name"": ""War""}, {""id"": 18, ""name"": ""Drama""}]","[{""id"": 1628, ""name"": ""nationalism""}, {""id"": 1631, ""name"": ""concentration camp""}, {""id"": 1956, ""name"": ""world war ii""}, {""id"": 2451, ""name"": ""gas chamber""}, {""id"": 2652, ""name"": ""nazis""}, {""id"": 3207, ""name"": ""concentration camp prisoner""}]",7.7,1451,2008-05-07
A Walk Among the Tombstones,Private investigator Matthew Scudder is hired by a drug kingpin to find out who kidnapped and murdered his wife.,"[{""id"": 80, ""name"": ""Crime""}, {""id"": 18, ""name"": ""Drama""}, {""id"": 9648, ""name"": ""Mystery""}, {""id"": 53, ""name"": ""Thriller""}]","[{""id"": 818, ""name"": ""based on novel""}, {""id"": 9826, ""name"": ""murder""}, {""id"": 10391, ""name"": ""mafia""}, {""id"": 11168, ""name"": ""private investigator""}, {""id"": 14512, ""name"": ""new york city""}, {""id"": 33457, ""name"": ""alcoholic""}, {""id"": 167580, ""name"": ""kingpin""}, {""id"": 199073, ""name"": ""wife murder""}, {""id"": 207847, ""name"": ""matt scudder""}]",6.2,1131,2014-09-18
Florence Foster Jenkins,"The story of Florence Foster Jenkins, a New York heiress, who dreamed of becoming an opera singer, despite having a terrible singing voice.","[{""id"": 35, ""name"": ""Comedy""}, {""id"": 18, ""name"": ""Drama""}]","[{""id"": 2199, ""name"": ""opera""}, {""id"": 5565, ""name"": ""biography""}, {""id"": 235768, ""name"": ""singing false""}]",6.6,392,2016-05-06
Pirates of the Caribbean: The Curse of the Black Pearl,"Jack Sparrow, a freewheeling 17th-century pirate who roams the Caribbean Sea, butts heads with a rival pirate bent on pillaging the village of Port Royal. When the governor's daughter is kidnapped, Sparrow decides to help the girl's love save her. But their seafaring mission is hardly simple.","[{""id"": 12, ""name"": ""Adventure""}, {""id"": 14, ""name"": ""Fantasy""}, {""id"": 28, ""name"": ""Action""}]","[{""id"": 911, ""name"": ""exotic island""}, {""id"": 1318, ""name"": ""blacksmith""}, {""id"": 1319, ""name"": ""east india trading company""}, {""id"": 1321, ""name"": ""gold""}, {""id"": 1459, ""name"": ""marriage proposal""}, {""id"": 1860, ""name"": ""mutiny""}, {""id"": 3266, ""name"": ""jamaica""}, {""id"": 4062, ""name"": ""skeleton""}, {""id"": 5600, ""name"": ""daughter""}, {""id"": 5744, ""name"": ""governor""}, {""id"": 11086, ""name"": ""wooden eye""}, {""id"": 11087, ""name"": ""gold coin""}, {""id"": 12988, ""name"": ""pirate""}, {""id"": 33457, ""name"": ""alcoholic""}, {""id"": 157186, ""name"": ""swashbuckler""}, {""id"": 167861, ""name"": ""caribbean""}, {""id"": 179430, ""name"": ""aftercreditsstinger""}, {""id"": 185200, ""name"": ""pirate ship""}, {""id"": 235625, ""name"": ""capuchin monkey""}, {""id"": 235626, ""name"": ""tortuga""}]",7.5,6985,2003-07-09
Pirates of the Caribbean: At World's End,"Captain Barbossa, long believed to be dead, has come back to life and is headed to the edge of the Earth with Will Turner and Elizabeth Swann. But nothing is quite as it seems.","[{""id"": 12, ""name"": ""Adventure""}, {""id"": 14, ""name"": ""Fantasy""}, {""id"": 28, ""name"": ""Action""}]","[{""id"": 270, ""name"": ""ocean""}, {""id"": 726, ""name"": ""drug abuse""}, {""id"": 911, ""name"": ""exotic island""}, {""id"": 1319, ""name"": ""east india trading company""}, {""id"": 2038, ""name"": ""love of one's life""}, {""id"": 2052, ""name"": ""traitor""}, {""id"": 2580, ""name"": ""shipwreck""}, {""id"": 2660, ""name"": ""strong woman""}, {""id"": 3799, ""name"": ""ship""}, {""id"": 5740, ""name"": ""alliance""}, {""id"": 5941, ""name"": ""calypso""}, {""id"": 6155, ""name"": ""afterlife""}, {""id"": 6211, ""name"": ""fighter""}, {""id"": 12988, ""name"": ""pirate""}, {""id"": 157186, ""name"": ""swashbuckler""}, {""id"": 179430, ""name"": ""aftercreditsstinger""}]",6.9,4500,2007-05-19
Finding Nemo,"Nemo, an adventurous young clownfish, is unexpectedly taken from his Great Barrier Reef home to a dentist's office aquarium. It's up to his worrisome father Marlin and a friendly but forgetful fish Dory to bring Nemo home -- meeting vegetarian sharks, surfer dude turtles, hypnotic jellyfish, hungry seagulls, and more along the way.","[{""id"": 16, ""name"": ""Animation""}, {""id"": 10751, ""name"": ""Family""}]","[{""id"": 494, ""name"": ""father son relationship""}, {""id"": 10026, ""name"": ""harbor""}, {""id"": 14785, ""name"": ""underwater""}, {""id"": 33759, ""name"": ""fish tank""}, {""id"": 33760, ""name"": ""great barrier reef""}, {""id"": 156948, ""name"": ""missing child""}, {""id"": 179430, ""name"": ""aftercreditsstinger""}, {""id"": 179431, ""name"": ""duringcreditsstinger""}, {""id"": 180557, ""name"": ""short term memory loss""}, {""id"": 180568, ""name"": ""clownfish""}, {""id"": 180574, ""name"": ""father son reunion""}, {""id"": 181068, ""name"": ""protective father""}]",7.6,6122,2003-05-30
There Will Be Blood,"When ruthless oil prospector, Daniel Plainview learns of oil-rich land in California that can be bought cheaply, he moves his operation there and begins manipulating and exploiting the local landowners into selling him their property. Using his young adopted son to project the image of a caring family man, Plainview gains the cooperation of almost all the locals with lofty promises to build schools and cultivate the land to make their community flourish. Over time, Plainview's gradual accumulation of wealth and power causes his true self to surface, and he begins to slowly alienate himself from everyone in his life.","[{""id"": 18, ""name"": ""Drama""}]","[{""id"": 380, ""name"": ""brother brother relationship""}, {""id"": 1635, ""name"": ""deaf-mute""}, {""id"": 2355, ""name"": ""american dream""}, {""id"": 3419, ""name"": ""fanatic""}, {""id"": 3535, ""name"": ""pipeline""}, {""id"": 5175, ""name"": ""petrol""}, {""id"": 5905, ""name"": ""father""}, {""id"": 6669, ""name"": ""step father""}, {""id"": 10590, ""name"": ""oil""}, {""id"": 10594, ""name"": ""money""}, {""id"": 15127, ""name"": ""killer""}, {""id"": 33457, ""name"": ""alcoholic""}]",7.9,1537,2007-12-28
Noah,A man who suffers visions of an apocalyptic deluge takes measures to protect his family from the coming flood.,"[{""id"": 18, ""name"": ""Drama""}, {""id"": 12, ""name"": ""Adventure""}]","[{""id"": 3036, ""name"": ""bible""}, {""id"": 9649, ""name"": ""god""}, {""id"": 195790, ""name"": ""noah""}, {""id"": 209714, ""name"": ""3d""}]",5.6,2350,2014-03-20
Pirates of the Caribbean: Dead Man's Chest,"Captain Jack Sparrow works his way out of a blood debt with the ghostly Davey Jones, he also attempts to avoid eternal damnation.","[{""id"": 12, ""name"": ""Adventure""}, {""id"": 14, ""name"": ""Fantasy""}, {""id"": 28, ""name"": ""Action""}]","[{""id"": 616, ""name"": ""witch""}, {""id"": 663, ""name"": ""fortune teller""}, {""id"": 910, ""name"": ""bondage""}, {""id"": 911, ""name"": ""exotic island""}, {""id"": 1299, ""name"": ""monster""}, {""id"": 1316, ""name"": ""captain""}, {""id"": 1317, ""name"": ""card game""}, {""id"": 1319, ""name"": ""east india trading company""}, {""id"": 1461, ""name"": ""compass""}, {""id"": 3799, ""name"": ""ship""}, {""id"": 5600, ""name"": ""daughter""}, {""id"": 12988, ""name"": ""pirate""}, {""id"": 157186, ""name"": ""swashbuckler""}, {""id"": 179430, ""name"": ""aftercreditsstinger""}]",7.0,5246,2006-06-20
Seven Psychopaths,A struggling screenwriter inadvertently becomes entangled in the Los Angeles criminal underworld after his oddball friends kidnap a gangster's beloved Shih Tzu.,"[{""id"": 35, ""name"": ""Comedy""}, {""id"": 80, ""name"": ""Crime""}]","[{""id"": 236, ""name"": ""suicide""}, {""id"": 567, ""name"": ""alcohol""}, {""id"": 572, ""name"": ""sex""}, {""id"": 888, ""name"": ""screenwriter""}, {""id"": 1449, ""name"": ""underworld""}, {""id"": 1721, ""name"": ""fight""}, {""id"": 1930, ""name"": ""kidnapping""}, {""id"": 8508, ""name"": ""party""}, {""id"": 9826, ""name"": ""murder""}, {""id"": 11454, ""name"": ""scam""}, {""id"": 12670, ""name"": ""los angeles""}, {""id"": 13142, ""name"": ""gangster""}, {""id"": 14601, ""name"": ""explosion""}, {""id"": 15009, ""name"": ""criminal""}, {""id"": 186892, ""name"": ""shih tzu""}, {""id"": 201858, ""name"": ""struggling""}]",6.7,1206,2012-09-07
Magic Mike XXL,"Three years after Mike bowed out of the stripper life at the top of his game, he and the remaining Kings of Tampa hit the road to Myrtle Beach to put on one last blow-out performance.","[{""id"": 35, ""name"": ""Comedy""}, {""id"": 18, ""name"": ""Drama""}, {""id"": 10402, ""name"": ""Music""}]","[{""id"": 3230, ""name"": ""male friendship""}, {""id"": 3688, ""name"": ""strip club""}, {""id"": 7312, ""name"": ""road trip""}, {""id"": 155857, ""name"": ""strip tease""}, {""id"": 199040, ""name"": ""strip""}]",6.3,706,2015-07-01
Rio 2,"It's a jungle out there for Blu, Jewel and their three kids after they're hurtled from Rio de Janeiro to the wilds of the Amazon. As Blu tries to fit in, he goes beak-to-beak with the vengeful Nigel, and meets the most fearsome adversary of all: his father-in-law.","[{""id"": 16, ""name"": ""Animation""}, {""id"": 12, ""name"": ""Adventure""}, {""id"": 35, ""name"": ""Comedy""}, {""id"": 10751, ""name"": ""Family""}]","[{""id"": 2646, ""name"": ""bird""}, {""id"": 9663, ""name"": ""sequel""}, {""id"": 10787, ""name"": ""jungle""}, {""id"": 33928, ""name"": ""audition""}, {""id"": 166103, ""name"": ""amazon rainforest""}, {""id"": 198270, ""name"": ""parrots""}]",6.3,978,2014-03-19
Easy A,"After a little white lie about losing her virginity gets out, a clean cut high school girl sees her life paralleling Hester Prynne's in ""The Scarlet Letter,"" which she is currently studying in school - until she decides to use the rumor mill to advance her social and financial standing.","[{""id"": 35, ""name"": ""Comedy""}]","[{""id"": 2251, ""name"": ""lie""}, {""id"": 6270, ""name"": ""high school""}, {""id"": 10873, ""name"": ""school""}, {""id"": 11870, ""name"": ""teen movie""}, {""id"": 189868, ""name"": ""rumor""}]",6.7,2210,2010-09-10
42,"The powerful story of Jackie Robinson, the legendary baseball player who broke Major League Baseball’s color barrier when he joined the roster of the Brooklyn Dodgers. The film follows the innovative Dodgers’ general manager Branch Rickey, the MLB executive who first signed Robinson to the minors and then helped to bring him up to the show.","[{""id"": 18, ""name"": ""Drama""}]","[{""id"": 1480, ""name"": ""baseball""}, {""id"": 5565, ""name"": ""biography""}, {""id"": 6075, ""name"": ""sport""}, {""id"": 186654, ""name"": ""brooklyn dodgers""}]",6.8,787,2013-04-12
Jupiter Ascending,"In a universe where human genetic material is the most precious commodity, an impoverished young Earth woman becomes the key to strategic maneuvers and internal strife within a powerful dynasty…","[{""id"": 878, ""name"": ""Science Fiction""}, {""id"": 14, ""name"": ""Fantasy""}, {""id"": 28, ""name"": ""Action""}, {""id"": 12, ""name"": ""Adventure""}]","[{""id"": 306, ""name"": ""jupiter""}, {""id"": 9882, ""name"": ""space""}, {""id"": 187056, ""name"": ""woman director""}, {""id"": 209714, ""name"": ""3d""}, {""id"": 212760, ""name"": ""interspecies romance""}]",5.2,2768,2015-02-04
Transformers: Dark of the Moon,"Sam Witwicky takes his first tenuous steps into adulthood while remaining a reluctant human ally of Autobot-leader Optimus Prime. The film centers around the space race between the USSR and the USA, suggesting there was a hidden Transformers role in it all that remains one of the planet's most dangerous secrets.","[{""id"": 28, ""name"": ""Action""}, {""id"": 878, ""name"": ""Science Fiction""}, {""id"": 12, ""name"": ""Adventure""}]","[{""id"": 305, ""name"": ""moon""}, {""id"": 1612, ""name"": ""spacecraft""}, {""id"": 2052, ""name"": ""traitor""}, {""id"": 3088, ""name"": ""bodyguard""}, {""id"": 10158, ""name"": ""alien planet""}, {""id"": 10244, ""name"": ""based on cartoon""}, {""id"": 10607, ""name"": ""transformers""}, {""id"": 10891, ""name"": ""giant robot""}, {""id"": 15246, ""name"": ""sabotage""}, {""id"": 15247, ""name"": ""word domination""}, {""id"": 15248, ""name"": ""commando""}, {""id"": 179431, ""name"": ""duringcreditsstinger""}]",6.1,3299,2011-06-28
