title,plot,genres,keywords,rating,num_votes,release_date
Deadpool,"Deadpool tells the origin story of former Special Forces operative turned mercenary Wade Wilson, who after being subjected to a rogue experiment that leaves him with accelerated healing powers, adopts the alter ego Deadpool. Armed with his new abilities and a dark, twisted sense of humor, Deadpool hunts down the man who nearly destroyed his life.","[{""id"": 28, ""name"": ""Action""}, {""id"": 12, ""name"": ""Adventure""}, {""id"": 35, ""name"": ""Comedy""}]","[{""id"": 2095, ""name"": ""anti hero""}, {""id"": 3070, ""name"": ""mercenary""}, {""id"": 8828, ""name"": ""marvel comic""}, {""id"": 9715, ""name"": ""superhero""}, {""id"": 9717, ""name"": ""based on comic book""}, {""id"": 11687, ""name"": ""breaking the fourth wall""}, {""id"": 179430, ""name"": ""aftercreditsstinger""}, {""id"": 179431, ""name"": ""duringcreditsstinger""}, {""id"": 223060, ""name"": ""self healing""}]",7.4,10995,2016-02-09
Interstellar,Interstellar chronicles the adventures of a group of explorers who make use of a newly discovered wormhole to surpass the limitations on human space travel and conquer the vast distances involved in an interstellar voyage.,"[{""id"": 12, ""name"": ""Adventure""}, {""id"": 18, ""name"": ""Drama""}, {""id"": 878, ""name"": ""Science Fiction""}]","[{""id"": 83, ""name"": ""saving the world""}, {""id"": 310, ""name"": ""artificial intelligence""}, {""id"": 494, ""name"": ""father son relationship""}, {""id"": 641, ""name"": ""single parent""}, {""id"": 1432, ""name"": ""nasa""}, {""id"": 1963, ""name"": ""expedition""}, {""id"": 3417, ""name"": ""wormhole""}, {""id"": 3801, ""name"": ""space travel""}, {""id"": 4337, ""name"": ""famine""}, {""id"": 4380, ""name"": ""black hole""}, {""id"": 4565, ""name"": ""dystopia""}, {""id"": 4776, ""name"": ""race against time""}, {""id"": 8056, ""name"": ""quantum mechanics""}, {""id"": 9831, ""name"": ""spaceship""}, {""id"": 9882, ""name"": ""space""}, {""id"": 10084, ""name"": ""rescue""}, {""id"": 10235, ""name"": ""family relationships""}, {""id"": 13127, ""name"": ""farmhouse""}, {""id"": 14544, ""name"": ""robot""}, {""id"": 14626, ""name"": ""astronaut""}, {""id"": 14760, ""name"": ""scientist""}, {""id"": 15300, ""name"": ""father daughter relationship""}, {""id"": 33479, ""name"": ""single father""}, {""id"": 154846, ""name"": ""farmer""}, {""id"": 156039, ""name"": ""space station""}, {""id"": 156395, ""name"": ""imax""}, {""id"": 160331, ""name"": ""astrophysics""}, {""id"": 162630, ""name"": ""zero gravity""}, {""id"": 189098, ""name"": ""courage""}, {""id"": 208757, ""name"": ""time paradox""}, {""id"": 214349, ""name"": ""relativity""}]",8.1,10867,2014-11-05
Inside Out,"Growing up can be a bumpy road, and it's no exception for Riley, who is uprooted from her Midwest life when her father starts a new job in San Francisco. Like all of us, Riley is guided by her emotions - Joy, Fear, Anger, Disgust and Sadness. The emotions live in Headquarters, the control center inside Riley's mind, where they help advise her through everyday life. As Riley and her emotions struggle to adjust to a new life in San Francisco, turmoil ensues in Headquarters. Although Joy, Riley's main and most important emotion, tries to keep things positive, the emotions conflict on how best to navigate a new city, house and school.","[{""id"": 18, ""name"": ""Drama""}, {""id"": 35, ""name"": ""Comedy""}, {""id"": 16, ""name"": ""Animation""}, {""id"": 10751, ""name"": ""Family""}]","[{""id"": 1566, ""name"": ""dream""}, {""id"": 6513, ""name"": ""cartoon""}, {""id"": 7942, ""name"": ""imaginary friend""}, {""id"": 10336, ""name"": ""animation""}, {""id"": 18035, ""name"": ""family""}, {""id"": 18253, ""name"": ""moving""}, {""id"": 161155, ""name"": ""kids""}, {""id"": 163227, ""name"": ""unicorn""}, {""id"": 179431, ""name"": ""duringcreditsstinger""}, {""id"": 209714, ""name"": ""3d""}, {""id"": 211269, ""name"": ""emotions""}]",8.0,6560,2015-06-09
Guardians of the Galaxy,"Light years from Earth, 26 years after being abducted, Peter Quill finds himself the prime target of a manhunt after discovering an orb wanted by Ronan the Accuser.","[{""id"": 28, ""name"": ""Action""}, {""id"": 878, ""name"": ""Science Fiction""}, {""id"": 12, ""name"": ""Adventure""}]","[{""id"": 8828, ""name"": ""marvel comic""}, {""id"": 9831, ""name"": ""spaceship""}, {""id"": 9882, ""name"": ""space""}, {""id"": 12405, ""name"": ""outer space""}, {""id"": 13014, ""name"": ""orphan""}, {""id"": 175428, ""name"": ""adventurer""}, {""id"": 179430, ""name"": ""aftercreditsstinger""}, {""id"": 179431, ""name"": ""duringcreditsstinger""}, {""id"": 180547, ""name"": ""marvel cinematic universe""}]",7.9,9742,2014-07-30
The Martian,"During a manned mission to Mars, Astronaut Mark Watney is presumed dead after a fierce storm and left behind by his crew. But Watney has survived and finds himself stranded and alone on the hostile planet. With only meager supplies, he must draw upon his ingenuity, wit and spirit to subsist and find a way to signal to Earth that he is alive.","[{""id"": 18, ""name"": ""Drama""}, {""id"": 12, ""name"": ""Adventure""}, {""id"": 878, ""name"": ""Science Fiction""}]","[{""id"": 818, ""name"": ""based on novel""}, {""id"": 839, ""name"": ""mars""}, {""id"": 1432, ""name"": ""nasa""}, {""id"": 1533, ""name"": ""isolation""}, {""id"": 4003, ""name"": ""botanist""}, {""id"": 9743, ""name"": ""stranded""}, {""id"": 9831, ""name"": ""spaceship""}, {""id"": 9882, ""name"": ""space""}, {""id"": 10160, ""name"": ""engineering""}, {""id"": 10349, ""name"": ""survival""}, {""id"": 14626, ""name"": ""astronaut""}, {""id"": 156810, ""name"": ""science""}, {""id"": 168603, ""name"": ""deep space explorer""}, {""id"": 179431, ""name"": ""duringcreditsstinger""}, {""id"": 196367, ""name"": ""battle for survival""}]",7.6,7268,2015-09-30
Captain America: Civil War,"Following the events of Age of Ultron, the collective governments of the world pass an act designed to regulate all superhuman activity. This polarizes opinion amongst the Avengers, causing two factions to side with Iron Man or Captain America, which causes an epic battle between former allies.","[{""id"": 12, ""name"": ""Adventure""}, {""id"": 28, ""name"": ""Action""}, {""id"": 878, ""name"": ""Science Fiction""}]","[{""id"": 393, ""name"": ""civil war""}, {""id"": 6091, ""name"": ""war""}, {""id"": 8828, ""name"": ""marvel comic""}, {""id"": 9663, ""name"": ""sequel""}, {""id"": 9715, ""name"": ""superhero""}, {""id"": 9717, ""name"": ""based on comic book""}, {""id"": 156395, ""name"": ""imax""}, {""id"": 179430, ""name"": ""aftercreditsstinger""}, {""id"": 179431, ""name"": ""duringcreditsstinger""}, {""id"": 180547, ""name"": ""marvel cinematic universe""}, {""id"": 209714, ""name"": ""3d""}]",7.1,7241,2016-04-27
Whiplash,"Under the direction of a ruthless instructor, a talented young drummer begins to pursue perfection at any cost, even his humanity.","[{""id"": 18, ""name"": ""Drama""}]","[{""id"": 1416, ""name"": ""jazz""}, {""id"": 1523, ""name"": ""obsession""}, {""id"": 1640, ""name"": ""conservatory""}, {""id"": 2176, ""name"": ""music teacher""}, {""id"": 14512, ""name"": ""new york city""}, {""id"": 14819, ""name"": ""violence""}, {""id"": 33896, ""name"": ""montage""}, {""id"": 156823, ""name"": ""drummer""}, {""id"": 170418, ""name"": ""public humiliation""}, {""id"": 176095, ""name"": ""jazz band""}, {""id"": 206298, ""name"": ""young adult""}, {""id"": 207739, ""name"": ""music school""}]",8.3,4254,2014-10-10
The Imitation Game,"Based on the real life story of legendary cryptanalyst Alan Turing, the film portrays the nail-biting race against time by Turing and his brilliant team of code-breakers at Britain's top-secret Government Code and Cypher School at Bletchley Park, during the darkest days of World War II.","[{""id"": 36, ""name"": ""History""}, {""id"": 18, ""name"": ""Drama""}, {""id"": 53, ""name"": ""Thriller""}, {""id"": 10752, ""name"": ""War""}]","[{""id"": 237, ""name"": ""gay""}, {""id"": 392, ""name"": ""england""}, {""id"": 1956, ""name"": ""world war ii""}, {""id"": 2303, ""name"": ""mathematician""}, {""id"": 5565, ""name"": ""biography""}, {""id"": 208394, ""name"": ""logician""}, {""id"": 208395, ""name"": ""cryptography""}]",8.0,5723,2014-11-14
Mad Max: Fury Road,"An apocalyptic story set in the furthest reaches of our planet, in a stark desert landscape where humanity is broken, and most everyone is crazed fighting for the necessities of life. Within this world exist two rebels on the run who just might be able to restore order. There's Max, a man of action and a man of few words, who seeks peace of mind following the loss of his wife and child in the aftermath of the chaos. And Furiosa, a woman of action and a woman who believes her path to survival may be achieved if she can make it across the desert back to her childhood homeland.","[{""id"": 28, ""name"": ""Action""}, {""id"": 12, ""name"": ""Adventure""}, {""id"": 878, ""name"": ""Science Fiction""}, {""id"": 53, ""name"": ""Thriller""}]","[{""id"": 2964, ""name"": ""future""}, {""id"": 3713, ""name"": ""chase""}, {""id"": 4458, ""name"": ""post-apocalyptic""}, {""id"": 4565, ""name"": ""dystopia""}, {""id"": 5657, ""name"": ""australia""}, {""id"": 10084, ""name"": ""rescue""}, {""id"": 10349, ""name"": ""survival""}, {""id"": 10562, ""name"": ""on the run""}, {""id"": 155499, ""name"": ""convoy""}, {""id"": 190954, ""name"": ""peak oil""}, {""id"": 212516, ""name"": ""dark future""}]",7.2,9427,2015-05-13
Gone Girl,"With his wife's disappearance having become the focus of an intense media circus, a man sees the spotlight turned on him when it's suspected that he may not be innocent.","[{""id"": 9648, ""name"": ""Mystery""}, {""id"": 53, ""name"": ""Thriller""}, {""id"": 18, ""name"": ""Drama""}]","[{""id"": 818, ""name"": ""based on novel""}, {""id"": 5809, ""name"": ""marriage crisis""}, {""id"": 10941, ""name"": ""disappearance""}, {""id"": 11513, ""name"": ""cheating husband""}, {""id"": 156091, ""name"": ""missing person""}, {""id"": 169962, ""name"": ""search party""}, {""id"": 191199, ""name"": ""criminal lawyer""}, {""id"": 199073, ""name"": ""wife murder""}, {""id"": 207431, ""name"": ""murder suspect""}, {""id"": 222665, ""name"": ""missing wife""}]",7.9,5862,2014-10-01
Big Hero 6,"The special bond that develops between plus-sized inflatable robot Baymax, and prodigy Hiro Hamada, who team up with a group of friends to form a band of high-tech heroes.","[{""id"": 12, ""name"": ""Adventure""}, {""id"": 10751, ""name"": ""Family""}, {""id"": 16, ""name"": ""Animation""}, {""id"": 28, ""name"": ""Action""}, {""id"": 35, ""name"": ""Comedy""}]","[{""id"": 380, ""name"": ""brother brother relationship""}, {""id"": 1701, ""name"": ""hero""}, {""id"": 2276, ""name"": ""talent""}, {""id"": 9748, ""name"": ""revenge""}, {""id"": 12392, ""name"": ""best friend""}, {""id"": 12446, ""name"": ""another dimension""}, {""id"": 14544, ""name"": ""robot""}, {""id"": 33353, ""name"": ""boy genius""}, {""id"": 41509, ""name"": ""hate""}, {""id"": 179430, ""name"": ""aftercreditsstinger""}, {""id"": 198423, ""name"": ""moral dilemma""}, {""id"": 209714, ""name"": ""3d""}, {""id"": 213104, ""name"": ""teen superheroes""}, {""id"": 215235, ""name"": ""dead brother""}]",7.8,6135,2014-10-24
Avengers: Age of Ultron,"When Tony Stark tries to jumpstart a dormant peacekeeping program, things go awry and Earth’s Mightiest Heroes are put to the ultimate test as the fate of the planet hangs in the balance. As the villainous Ultron emerges, it is up to The Avengers to stop him from enacting his terrible plans, and soon uneasy alliances and unexpected action pave the way for an epic and unique global adventure.","[{""id"": 28, ""name"": ""Action""}, {""id"": 12, ""name"": ""Adventure""}, {""id"": 878, ""name"": ""Science Fiction""}]","[{""id"": 8828, ""name"": ""marvel comic""}, {""id"": 9663, ""name"": ""sequel""}, {""id"": 9715, ""name"": ""superhero""}, {""id"": 9717, ""name"": ""based on comic book""}, {""id"": 10629, ""name"": ""vision""}, {""id"": 155030, ""name"": ""superhero team""}, {""id"": 179431, ""name"": ""duringcreditsstinger""}, {""id"": 180547, ""name"": ""marvel cinematic universe""}, {""id"": 209714, ""name"": ""3d""}]",7.3,6767,2015-04-22
Ex Machina,"Caleb, a 26 year old coder at the world's largest internet company, wins a competition to spend a week at a private mountain retreat belonging to Nathan, the reclusive CEO of the company. But when Caleb arrives at the remote location he finds that he will have to participate in a strange and fascinating experiment in which he must interact with the world's first true artificial intelligence, housed in the body of a beautiful robot girl.","[{""id"": 18, ""name"": ""Drama""}, {""id"": 878, ""name"": ""Science Fiction""}]","[{""id"": 246, ""name"": ""dancing""}, {""id"": 310, ""name"": ""artificial intelligence""}, {""id"": 1448, ""name"": ""distrust""}, {""id"": 1533, ""name"": ""isolation""}, {""id"": 1576, ""name"": ""technology""}, {""id"": 2887, ""name"": ""manipulation""}, {""id"": 6054, ""name"": ""friendship""}, {""id"": 9758, ""name"": ""deception""}, {""id"": 10124, ""name"": ""laboratory""}, {""id"": 14544, ""name"": ""robot""}, {""id"": 14755, ""name"": ""power outage""}, {""id"": 159433, ""name"": ""surveillance camera""}, {""id"": 161219, ""name"": ""consciousness""}, {""id"": 181324, ""name"": ""existentialism""}, {""id"": 186523, ""name"": ""lockdown""}, {""id"": 212737, ""name"": ""philosophical""}, {""id"": 214820, ""name"": ""robot human relationship""}, {""id"": 227497, ""name"": ""turing test""}, {""id"": 233005, ""name"": ""cybernetics""}]",7.6,4737,2015-01-21
Room,Jack is a young boy of 5 years old who has lived all his life in one room. He believes everything within it are the only real things in the world. But what will happen when his Ma suddenly tells him that there are other things outside of Room?,"[{""id"": 18, ""name"": ""Drama""}, {""id"": 53, ""name"": ""Thriller""}]","[{""id"": 818, ""name"": ""based on novel""}, {""id"": 1337, ""name"": ""carpet""}, {""id"": 1533, ""name"": ""isolation""}, {""id"": 1930, ""name"": ""kidnapping""}, {""id"": 2883, ""name"": ""imprisonment""}, {""id"": 9229, ""name"": ""grandparents""}, {""id"": 10685, ""name"": ""escape""}, {""id"": 11612, ""name"": ""hospital""}, {""id"": 15162, ""name"": ""dog""}, {""id"": 15381, ""name"": ""captive""}, {""id"": 157499, ""name"": ""mother son relationship""}, {""id"": 221604, ""name"": ""shed""}, {""id"": 221605, ""name"": ""skylight""}]",8.1,2757,2015-10-16
The Grand Budapest Hotel,"The Grand Budapest Hotel tells of a legendary concierge at a famous European hotel between the wars and his friendship with a young employee who becomes his trusted protégé. The story involves the theft and recovery of a priceless Renaissance painting, the battle for an enormous family fortune and the slow and then sudden upheavals that transformed Europe during the first half of the 20th century.","[{""id"": 35, ""name"": ""Comedy""}, {""id"": 18, ""name"": ""Drama""}]","[{""id"": 612, ""name"": ""hotel""}, {""id"": 5918, ""name"": ""painting""}, {""id"": 11159, ""name"": ""wartime""}, {""id"": 12371, ""name"": ""gunfight""}, {""id"": 14604, ""name"": ""theft""}, {""id"": 172772, ""name"": ""mentor prot\u00e9g\u00e9 relationship""}, {""id"": 181046, ""name"": ""european""}, {""id"": 188688, ""name"": ""hotel lobby""}, {""id"": 207257, ""name"": ""renaissance painting""}]",8.0,4519,2014-02-26
The Revenant,"In the 1820s, a frontiersman, Hugh Glass, sets out on a path of vengeance against those who left him for dead after a bear mauling.","[{""id"": 37, ""name"": ""Western""}, {""id"": 18, ""name"": ""Drama""}, {""id"": 12, ""name"": ""Adventure""}, {""id"": 53, ""name"": ""Thriller""}]","[{""id"": 494, ""name"": ""father son relationship""}, {""id"": 570, ""name"": ""rape""}, {""id"": 818, ""name"": ""based on novel""}, {""id"": 1262, ""name"": ""mountains""}, {""id"": 1442, ""name"": ""winter""}, {""id"": 2522, ""name"": ""grizzly bear""}, {""id"": 3593, ""name"": ""wilderness""}, {""id"": 9454, ""name"": ""frontier""}, {""id"": 9748, ""name"": ""revenge""}, {""id"": 9826, ""name"": ""murder""}, {""id"": 10322, ""name"": ""native american""}, {""id"": 10349, ""name"": ""survival""}, {""id"": 10468, ""name"": ""bear""}, {""id"": 10794, ""name"": ""snow""}, {""id"": 14819, ""name"": ""violence""}, {""id"": 157164, ""name"": ""animal death""}, {""id"": 158175, ""name"": ""bear attack""}, {""id"": 159138, ""name"": ""death of son""}, {""id"": 185722, ""name"": ""based on true events""}, {""id"": 194976, ""name"": ""fur trapper""}]",7.3,6396,2015-12-25
The Hateful Eight,Bounty hunters seek shelter from a raging blizzard and get caught up in a plot of betrayal and deception.,"[{""id"": 80, ""name"": ""Crime""}, {""id"": 18, ""name"": ""Drama""}, {""id"": 9648, ""name"": ""Mystery""}, {""id"": 37, ""name"": ""Western""}]","[{""id"": 801, ""name"": ""bounty hunter""}, {""id"": 1016, ""name"": ""wyoming""}, {""id"": 1262, ""name"": ""mountains""}, {""id"": 2398, ""name"": ""narration""}, {""id"": 7150, ""name"": ""hangman""}, {""id"": 33600, ""name"": ""stagecoach""}, {""id"": 156783, ""name"": ""blizzard""}, {""id"": 187321, ""name"": ""post civil war""}]",7.6,4274,2015-12-25
The Wolf of Wall Street,"A New York stockbroker refuses to cooperate in a large securities fraud case involving corruption on Wall Street, corporate banking world and mob infiltration. Based on Jordan Belfort's autobiography.","[{""id"": 80, ""name"": ""Crime""}, {""id"": 18, ""name"": ""Drama""}, {""id"": 35, ""name"": ""Comedy""}]","[{""id"": 417, ""name"": ""corruption""}, {""id"": 572, ""name"": ""sex""}, {""id"": 738, ""name"": ""sexuality""}, {""id"": 974, ""name"": ""bank""}, {""id"": 3923, ""name"": ""humor""}, {""id"": 5565, ""name"": ""biography""}, {""id"": 5636, ""name"": ""wall street""}, {""id"": 5809, ""name"": ""marriage crisis""}, {""id"": 6974, ""name"": ""rise and fall""}, {""id"": 10631, ""name"": ""stockbroker""}, {""id"": 14964, ""name"": ""drug""}, {""id"": 179018, ""name"": ""stock broker""}]",7.9,6571,2013-12-25
Me Before You,"A small town girl is caught between dead-end jobs. A high-profile, successful man becomes wheelchair bound following an accident. The man decides his life is not worth living until the girl is hired for six months to be his new caretaker. Worlds apart and trapped together by circumstance, the two get off to a rocky start. But the girl becomes determined to prove to the man that life is worth living and as they embark on a series of adventures together, each finds their world changing in ways neither of them could begin to imagine.","[{""id"": 18, ""name"": ""Drama""}, {""id"": 10749, ""name"": ""Romance""}]","[{""id"": 392, ""name"": ""england""}, {""id"": 818, ""name"": ""based on novel""}, {""id"": 894, ""name"": ""depression""}, {""id"": 1415, ""name"": ""small town""}, {""id"": 2564, ""name"": ""wheelchair""}, {""id"": 10241, ""name"": ""caretaker""}, {""id"": 155209, ""name"": ""caregiver""}, {""id"": 158558, ""name"": ""disabled""}, {""id"": 169152, ""name"": ""twenty something""}, {""id"": 187056, ""name"": ""woman director""}, {""id"": 191100, ""name"": ""romantic drama""}, {""id"": 207443, ""name"": ""dead end job""}, {""id"": 207819, ""name"": ""accident""}]",7.6,2562,2016-06-02
Captain America: The Winter Soldier,"After the cataclysmic events in New York with The Avengers, Steve Rogers, aka Captain America is living quietly in Washington, D.C. and trying to adjust to the modern world. But when a S.H.I.E.L.D. colleague comes under attack, Steve becomes embroiled in a web of intrigue that threatens to put the world at risk. Joining forces with the Black Widow, Captain America struggles to expose the ever-widening conspiracy while fighting off professional assassins sent to silence him at every turn. When the full scope of the villainous plot is revealed, Captain America and the Black Widow enlist the help of a new ally, the Falcon. However, they soon find themselves up against an unexpected and formidable enemy—the Winter Soldier.","[{""id"": 28, ""name"": ""Action""}, {""id"": 12, ""name"": ""Adventure""}, {""id"": 878, ""name"": ""Science Fiction""}]","[{""id"": 521, ""name"": ""washington d.c.""}, {""id"": 2964, ""name"": ""future""}, {""id"": 5539, ""name"": ""shield""}, {""id"": 8828, ""name"": ""marvel comic""}, {""id"": 9715, ""name"": ""superhero""}, {""id"": 9717, ""name"": ""based on comic book""}, {""id"": 173775, ""name"": ""captain america""}, {""id"": 179430, ""name"": ""aftercreditsstinger""}, {""id"": 179431, ""name"": ""duringcreditsstinger""}, {""id"": 180547, ""name"": ""marvel cinematic universe""}, {""id"": 209714, ""name"": ""3d""}, {""id"": 209817, ""name"": ""political thriller""}]",7.6,5764,2014-03-20
Django Unchained,"With the help of a German bounty hunter, a freed slave sets out to rescue his wife from a brutal Mississippi plantation owner.","[{""id"": 18, ""name"": ""Drama""}, {""id"": 37, ""name"": ""Western""}]","[{""id"": 801, ""name"": ""bounty hunter""}, {""id"": 1701, ""name"": ""hero""}, {""id"": 3136, ""name"": ""plantation""}, {""id"": 3679, ""name"": ""society""}, {""id"": 6054, ""name"": ""friendship""}, {""id"": 9713, ""name"": ""friends""}, {""id"": 9748, ""name"": ""revenge""}, {""id"": 9823, ""name"": ""rivalry""}, {""id"": 10084, ""name"": ""rescue""}, {""id"": 10950, ""name"": ""shootout""}, {""id"": 12425, ""name"": ""racism""}, {""id"": 15017, ""name"": ""danger""}, {""id"": 33780, ""name"": ""dentist""}, {""id"": 160324, ""name"": ""django""}, {""id"": 163129, ""name"": ""dual role""}, {""id"": 179430, ""name"": ""aftercreditsstinger""}, {""id"": 187376, ""name"": ""odd couple""}, {""id"": 188772, ""name"": ""black slave""}, {""id"": 202703, ""name"": ""deadly""}, {""id"": 206687, ""name"": ""chases and races""}, {""id"": 207928, ""name"": ""19th century""}]",7.8,10099,2012-12-25
X-Men: Days of Future Past,The ultimate X-Men ensemble fights a war for the survival of the species across two time periods as they join forces with their younger selves in an epic battle that must change the past – to save our future.,"[{""id"": 28, ""name"": ""Action""}, {""id"": 12, ""name"": ""Adventure""}, {""id"": 14, ""name"": ""Fantasy""}, {""id"": 878, ""name"": ""Science Fiction""}]","[{""id"": 1228, ""name"": ""1970s""}, {""id"": 1852, ""name"": ""mutant""}, {""id"": 4379, ""name"": ""time travel""}, {""id"": 8828, ""name"": ""marvel comic""}, {""id"": 9717, ""name"": ""based on comic book""}, {""id"": 10761, ""name"": ""superhuman""}, {""id"": 14527, ""name"": ""storm""}, {""id"": 161271, ""name"": ""beast""}, {""id"": 179430, ""name"": ""aftercreditsstinger""}, {""id"": 206736, ""name"": ""changing the past or future""}]",7.5,6032,2014-05-15
Inception,"Cobb, a skilled thief who commits corporate espionage by infiltrating the subconscious of his targets is offered a chance to regain his old life as payment for a task considered to be impossible: ""inception"", the implantation of another person's idea into a target's subconscious.","[{""id"": 28, ""name"": ""Action""}, {""id"": 53, ""name"": ""Thriller""}, {""id"": 878, ""name"": ""Science Fiction""}, {""id"": 9648, ""name"": ""Mystery""}, {""id"": 12, ""name"": ""Adventure""}]","[{""id"": 1014, ""name"": ""loss of lover""}, {""id"": 1566, ""name"": ""dream""}, {""id"": 1930, ""name"": ""kidnapping""}, {""id"": 2116, ""name"": ""sleep""}, {""id"": 2117, ""name"": ""subconsciousness""}, {""id"": 10051, ""name"": ""heist""}, {""id"": 11436, ""name"": ""redemption""}, {""id"": 160137, ""name"": ""female hero""}]",8.1,13752,2010-07-14
Spotlight,"The true story of how The Boston Globe uncovered the massive scandal of child abuse and the cover-up within the local Catholic Archdiocese, shaking the entire Catholic Church to its core.","[{""id"": 18, ""name"": ""Drama""}, {""id"": 53, ""name"": ""Thriller""}, {""id"": 36, ""name"": ""History""}]","[{""id"": 516, ""name"": ""child abuse""}, {""id"": 917, ""name"": ""journalism""}, {""id"": 934, ""name"": ""judge""}, {""id"": 1196, ""name"": ""florida""}, {""id"": 1680, ""name"": ""boston""}, {""id"": 2337, ""name"": ""pedophilia""}, {""id"": 6148, ""name"": ""court""}, {""id"": 9665, ""name"": ""cover-up""}, {""id"": 10093, ""name"": ""priest""}, {""id"": 10909, ""name"": ""lawyer""}, {""id"": 18396, ""name"": ""catholic""}, {""id"": 157008, ""name"": ""catholic church""}, {""id"": 161207, ""name"": ""catholicism""}, {""id"": 161304, ""name"": ""september 11 2001""}, {""id"": 195240, ""name"": ""investigative journalism""}, {""id"": 204357, ""name"": ""cardinal""}, {""id"": 207317, ""name"": ""christmas""}]",7.8,2686,2015-11-06
Edge of Tomorrow,"Major Bill Cage is an officer who has never seen a day of combat when he is unceremoniously demoted and dropped into combat. Cage is killed within minutes, managing to take an alpha alien down with him. He awakens back at the beginning of the same day and is forced to fight and die again... and again - as physical contact with the alien has thrown him into a time loop.","[{""id"": 28, ""name"": ""Action""}, {""id"": 878, ""name"": ""Science Fiction""}]","[{""id"": 563, ""name"": ""deja vu""}, {""id"": 1521, ""name"": ""time warp""}, {""id"": 2062, ""name"": ""restart""}, {""id"": 4565, ""name"": ""dystopia""}, {""id"": 6091, ""name"": ""war""}, {""id"": 9951, ""name"": ""alien""}, {""id"": 11109, ""name"": ""military officer""}, {""id"": 13065, ""name"": ""soldier""}, {""id"": 14909, ""name"": ""alien invasion""}, {""id"": 204318, ""name"": ""exoskeleton""}]",7.6,4858,2014-05-27
