title,plot,genres,keywords,rating,num_votes,release_date
Warrior,"The inspirational story of an estranged family that finds redemption in the unlikeliest of places…the MMA ring. Tommy Riordan (Tom Hardy), an ex-marine with a tragic past, returns home and enlists his father (Nick Nolte), a recovering alcoholic and former wrestling coach, to train him for “Sparta”, the biggest MMA tournament ever held. But when Tommy’s underdog brother, Brendan (Joel Edgerton), fights his way into the tournament, the two brothers must finally confront each other and the forces that pulled them apart. What ensues is the most gut-wrenching, soul-stirring, and unforgettable battle of their lives.","[{""id"": 28, ""name"": ""Action""}, {""id"": 18, ""name"": ""Drama""}]","[{""id"": 974, ""name"": ""bank""}, {""id"": 4613, ""name"": ""training""}, {""id"": 9849, ""name"": ""beating""}, {""id"": 9917, ""name"": ""mixed martial arts""}, {""id"": 10508, ""name"": ""teacher""}, {""id"": 14666, ""name"": ""muscleman""}, {""id"": 18543, ""name"": ""combat""}, {""id"": 33457, ""name"": ""alcoholic""}, {""id"": 33610, ""name"": ""gym""}, {""id"": 33611, ""name"": ""exercise""}]",7.7,1272,2011-09-09
Warm Bodies,"After a zombie becomes involved with the girlfriend of one of his victims, their romance sets in motion a sequence of events that might transform the entire lifeless world.","[{""id"": 27, ""name"": ""Horror""}, {""id"": 35, ""name"": ""Comedy""}, {""id"": 10749, ""name"": ""Romance""}]","[{""id"": 4458, ""name"": ""post-apocalyptic""}, {""id"": 4565, ""name"": ""dystopia""}, {""id"": 12377, ""name"": ""zombie""}, {""id"": 186565, ""name"": ""zombie apocalypse""}, {""id"": 212760, ""name"": ""interspecies romance""}, {""id"": 223438, ""name"": ""based on young adult novel""}]",6.4,2652,2013-01-31
The Butler,"A look at the life of Cecil Gaines who served eight presidents as the White House's head butler from 1952 to 1986, and had a unique front-row seat as political and racial history was made.","[{""id"": 18, ""name"": ""Drama""}]","[{""id"": 833, ""name"": ""white house""}, {""id"": 1307, ""name"": ""butler""}, {""id"": 5565, ""name"": ""biography""}, {""id"": 163116, ""name"": ""civil rights""}]",7.2,1101,2013-08-16
The Place Beyond the Pines,"A motorcycle stunt rider considers committing a crime in order to provide for his wife and child, an act that puts him on a collision course with a cop-turned-politician.","[{""id"": 18, ""name"": ""Drama""}, {""id"": 80, ""name"": ""Crime""}]","[{""id"": 417, ""name"": ""corruption""}, {""id"": 494, ""name"": ""father son relationship""}, {""id"": 3473, ""name"": ""carnival""}, {""id"": 10260, ""name"": ""mechanic""}, {""id"": 14735, ""name"": ""motorcycle""}, {""id"": 15363, ""name"": ""bank robbery""}]",6.8,1653,2013-03-20
The Neon Demon,"When aspiring model Jesse moves to Los Angeles, her youth and vitality are devoured by a group of beauty-obsessed women who will take any means necessary to get what she has.","[{""id"": 53, ""name"": ""Thriller""}, {""id"": 27, ""name"": ""Horror""}]","[{""id"": 14818, ""name"": ""model""}]",6.4,887,2016-06-08
Wild,A woman with a tragic past decides to start her new life by hiking for one thousand miles on the Pacific Crest Trail.,"[{""id"": 18, ""name"": ""Drama""}]","[{""id"": 4414, ""name"": ""adventure""}, {""id"": 5565, ""name"": ""biography""}, {""id"": 5827, ""name"": ""hiking""}, {""id"": 9672, ""name"": ""based on true story""}, {""id"": 197528, ""name"": ""traveller""}]",7.0,951,2014-12-05
The Giver,"In a seemingly perfect community, without war, pain, suffering, differences or choice, a young boy is chosen to learn from an elderly man about the true pain and pleasure of the ""real"" world.","[{""id"": 18, ""name"": ""Drama""}, {""id"": 878, ""name"": ""Science Fiction""}]","[{""id"": 4565, ""name"": ""dystopia""}, {""id"": 12999, ""name"": ""black and white""}, {""id"": 223438, ""name"": ""based on young adult novel""}]",6.4,1798,2014-08-11
District 9,"Aliens land in South Africa and, with their ship totally disabled,  have no way home. Years later, after living in a slum and wearing out their welcome the 'Non-Humans' are being moved to a new tent city overseen by Multi-National United (MNU).","[{""id"": 878, ""name"": ""Science Fiction""}]","[{""id"": 100, ""name"": ""slum""}, {""id"": 542, ""name"": ""street gang""}, {""id"": 2766, ""name"": ""mutation""}, {""id"": 3644, ""name"": ""south africa""}, {""id"": 4339, ""name"": ""johannesburg""}, {""id"": 4565, ""name"": ""dystopia""}, {""id"": 6017, ""name"": ""genetics""}, {""id"": 6086, ""name"": ""government""}, {""id"": 8201, ""name"": ""satire""}, {""id"": 9951, ""name"": ""alien""}, {""id"": 10650, ""name"": ""prawn""}, {""id"": 11800, ""name"": ""mockumentary""}, {""id"": 12026, ""name"": ""alternate history""}, {""id"": 12425, ""name"": ""racism""}, {""id"": 158276, ""name"": ""metamorphosis""}, {""id"": 160910, ""name"": ""xenophobia""}, {""id"": 195139, ""name"": ""internment camp""}, {""id"": 229740, ""name"": ""body transformation""}, {""id"": 231277, ""name"": ""alien technology""}, {""id"": 233016, ""name"": ""segregation""}]",7.3,3382,2009-08-05
The Departed,"To take down South Boston's Irish Mafia, the police send in one of their own to infiltrate the underworld, not realizing the syndicate has done likewise. While an undercover cop curries favor with the mob kingpin, a career criminal rises through the police ranks. But both sides soon discover there's a mole among them.","[{""id"": 18, ""name"": ""Drama""}, {""id"": 53, ""name"": ""Thriller""}, {""id"": 80, ""name"": ""Crime""}]","[{""id"": 1568, ""name"": ""undercover""}, {""id"": 1680, ""name"": ""boston""}, {""id"": 6149, ""name"": ""police""}, {""id"": 9713, ""name"": ""friends""}, {""id"": 10391, ""name"": ""mafia""}, {""id"": 11199, ""name"": ""undercover cop""}, {""id"": 11578, ""name"": ""mobster""}, {""id"": 14617, ""name"": ""mole""}, {""id"": 177235, ""name"": ""state police""}, {""id"": 177258, ""name"": ""police training""}, {""id"": 177259, ""name"": ""realtor""}]",7.9,4339,2006-10-05
The World's End,Five friends who reunite in an attempt to top their epic pub crawl from 20 years earlier unwittingly become humankind's only hope for survival.,"[{""id"": 35, ""name"": ""Comedy""}, {""id"": 28, ""name"": ""Action""}, {""id"": 878, ""name"": ""Science Fiction""}]","[{""id"": 10150, ""name"": ""end of the world""}, {""id"": 12332, ""name"": ""apocalypse""}, {""id"": 33452, ""name"": ""trilogy""}, {""id"": 172514, ""name"": ""homage""}]",6.7,1778,2013-07-18
The Best of Me,A pair of former high school sweethearts reunite after many years when they return to visit their small hometown.,"[{""id"": 18, ""name"": ""Drama""}, {""id"": 10749, ""name"": ""Romance""}]","[{""id"": 161272, ""name"": ""high school sweetheart""}]",7.2,765,2014-10-16
The Lord of the Rings: The Return of the King,"Aragorn is revealed as the heir to the ancient kings as he, Gandalf and the other members of the broken fellowship struggle to save Gondor from Sauron's forces. Meanwhile, Frodo and Sam bring the ring closer to the heart of Mordor, the dark lord's realm.","[{""id"": 12, ""name"": ""Adventure""}, {""id"": 14, ""name"": ""Fantasy""}, {""id"": 28, ""name"": ""Action""}]","[{""id"": 603, ""name"": ""elves""}, {""id"": 606, ""name"": ""orcs""}, {""id"": 609, ""name"": ""middle-earth (tolkien)""}, {""id"": 818, ""name"": ""based on novel""}, {""id"": 3301, ""name"": ""suspicion""}, {""id"": 3930, ""name"": ""bravery""}, {""id"": 6091, ""name"": ""war""}, {""id"": 9812, ""name"": ""honor""}, {""id"": 11173, ""name"": ""troll""}, {""id"": 14707, ""name"": ""brutality""}, {""id"": 14819, ""name"": ""violence""}, {""id"": 162846, ""name"": ""ghost""}, {""id"": 173700, ""name"": ""end of trilogy""}, {""id"": 207372, ""name"": ""quest""}, {""id"": 234213, ""name"": ""sword and sorcery""}]",8.1,8064,2003-12-01
Harry Potter and the Order of the Phoenix,"Returning for his fifth year of study at Hogwarts, Harry is stunned to find that his warnings about the return of Lord Voldemort have been ignored. Left with no choice, Harry takes matters into his own hands, training a small group of students – dubbed 'Dumbledore's Army' – to defend themselves against the dark arts.","[{""id"": 12, ""name"": ""Adventure""}, {""id"": 14, ""name"": ""Fantasy""}, {""id"": 10751, ""name"": ""Family""}, {""id"": 9648, ""name"": ""Mystery""}]","[{""id"": 530, ""name"": ""prophecy""}, {""id"": 616, ""name"": ""witch""}, {""id"": 1014, ""name"": ""loss of lover""}, {""id"": 2343, ""name"": ""magic""}, {""id"": 2630, ""name"": ""cutting the cord""}, {""id"": 3650, ""name"": ""child hero""}, {""id"": 3737, ""name"": ""dying and death""}, {""id"": 3872, ""name"": ""broom""}, {""id"": 3873, ""name"": ""sorcerer's apprentice""}, {""id"": 3884, ""name"": ""school of witchcraft""}, {""id"": 4252, ""name"": ""black magic""}, {""id"": 4959, ""name"": ""death of a friend""}, {""id"": 5147, ""name"": ""sorcery""}, {""id"": 221387, ""name"": ""occultism""}]",7.4,5494,2007-06-28
"Crazy, Stupid, Love.","Cal Weaver is living the American dream. He has a good job, a beautiful house, great children and a beautiful wife, named Emily. Cal's seemingly perfect life unravels, however, when he learns that Emily has been unfaithful and wants a divorce. Over 40 and suddenly single, Cal is adrift in the fickle world of dating. Enter, Jacob Palmer, a self-styled player who takes Cal under his wing and teaches him how to be a hit with the ladies.","[{""id"": 35, ""name"": ""Comedy""}, {""id"": 18, ""name"": ""Drama""}, {""id"": 10749, ""name"": ""Romance""}]","[{""id"": 815, ""name"": ""soulmates""}, {""id"": 1599, ""name"": ""midlife crisis""}, {""id"": 5809, ""name"": ""marriage crisis""}, {""id"": 9094, ""name"": ""womanizer""}, {""id"": 9798, ""name"": ""law school""}, {""id"": 14532, ""name"": ""crazy""}, {""id"": 14534, ""name"": ""relationship""}]",7.0,2443,2011-07-29
Sausage Party,"Sausage Party, the first R-rated CG animated movie, is about one sausage leading a group of supermarket products on a quest to discover the truth about their existence and what really happens when they become chosen to leave the grocery store.","[{""id"": 12, ""name"": ""Adventure""}, {""id"": 16, ""name"": ""Animation""}, {""id"": 35, ""name"": ""Comedy""}, {""id"": 14, ""name"": ""Fantasy""}]","[{""id"": 1545, ""name"": ""supermarket""}, {""id"": 8508, ""name"": ""party""}, {""id"": 9956, ""name"": ""sausage""}, {""id"": 10637, ""name"": ""food""}, {""id"": 11500, ""name"": ""anthropomorphism""}, {""id"": 18049, ""name"": ""sex scene""}, {""id"": 155707, ""name"": ""musical number""}, {""id"": 161919, ""name"": ""adult animation""}, {""id"": 168867, ""name"": ""grocery store""}, {""id"": 228646, ""name"": ""gum""}]",5.6,2238,2016-07-11
In Time,"In the not-too-distant future the aging gene has been switched off. To avoid overpopulation, time has become the currency and the way people pay for luxuries and necessities. The rich can live forever, while the rest try to negotiate for their immortality. A poor young man who comes into a fortune of time, though too late to help his mother from dying. He ends up on the run from a corrupt police force known as 'time keepers'.","[{""id"": 28, ""name"": ""Action""}, {""id"": 53, ""name"": ""Thriller""}, {""id"": 878, ""name"": ""Science Fiction""}]","[{""id"": 974, ""name"": ""bank""}, {""id"": 2964, ""name"": ""future""}, {""id"": 3667, ""name"": ""time""}, {""id"": 4565, ""name"": ""dystopia""}, {""id"": 4776, ""name"": ""race against time""}, {""id"": 4978, ""name"": ""immortality""}, {""id"": 10562, ""name"": ""on the run""}, {""id"": 14514, ""name"": ""class differences""}, {""id"": 41616, ""name"": ""cops and robbers\u00a0""}, {""id"": 220487, ""name"": ""rich vs poor""}]",6.7,3417,2011-10-27
Pirates of the Caribbean: On Stranger Tides,"Captain Jack Sparrow crosses paths with a woman from his past, and he's not sure if it's love -- or if she's a ruthless con artist who's using him to find the fabled Fountain of Youth. When she forces him aboard the Queen Anne's Revenge, the ship of the formidable pirate Blackbeard, Jack finds himself on an unexpected adventure in which he doesn't know who to fear more: Blackbeard or the woman from his past.","[{""id"": 12, ""name"": ""Adventure""}, {""id"": 28, ""name"": ""Action""}, {""id"": 14, ""name"": ""Fantasy""}]","[{""id"": 658, ""name"": ""sea""}, {""id"": 1316, ""name"": ""captain""}, {""id"": 1860, ""name"": ""mutiny""}, {""id"": 1938, ""name"": ""sword""}, {""id"": 2569, ""name"": ""prime minister""}, {""id"": 3180, ""name"": ""sailing""}, {""id"": 3625, ""name"": ""silver""}, {""id"": 3799, ""name"": ""ship""}, {""id"": 4235, ""name"": ""duke""}, {""id"": 5938, ""name"": ""mermaid""}, {""id"": 12988, ""name"": ""pirate""}, {""id"": 13065, ""name"": ""soldier""}, {""id"": 14643, ""name"": ""battle""}, {""id"": 157186, ""name"": ""swashbuckler""}, {""id"": 179430, ""name"": ""aftercreditsstinger""}, {""id"": 209714, ""name"": ""3d""}]",6.4,4948,2011-05-14
Zombieland,"Columbus has made a habit of running from what scares him. Tallahassee doesn't have fears. If he did, he'd kick their ever-living ass. In a world overrun by zombies, these two are perfectly evolved survivors. But now, they're about to stare down the most terrifying prospect of all: each other.","[{""id"": 35, ""name"": ""Comedy""}, {""id"": 27, ""name"": ""Horror""}]","[{""id"": 521, ""name"": ""washington d.c.""}, {""id"": 1156, ""name"": ""sister sister relationship""}, {""id"": 4458, ""name"": ""post-apocalyptic""}, {""id"": 7312, ""name"": ""road trip""}, {""id"": 8636, ""name"": ""blood splatter""}, {""id"": 9755, ""name"": ""parody""}, {""id"": 10349, ""name"": ""survival""}, {""id"": 12377, ""name"": ""zombie""}, {""id"": 14819, ""name"": ""violence""}, {""id"": 50009, ""name"": ""survival horror""}, {""id"": 155582, ""name"": ""amusement park""}, {""id"": 167068, ""name"": ""twinkie""}, {""id"": 167081, ""name"": ""body count""}, {""id"": 167085, ""name"": ""zombification""}, {""id"": 167095, ""name"": ""disposing of a dead body""}, {""id"": 167103, ""name"": ""bitten on the arm""}, {""id"": 167104, ""name"": ""loner""}, {""id"": 179430, ""name"": ""aftercreditsstinger""}, {""id"": 186565, ""name"": ""zombie apocalypse""}, {""id"": 235354, ""name"": ""fear of clowns""}]",7.2,3550,2009-10-07
Paddington,"A young Peruvian bear with a passion for all things British travels to London in search of a home. Finding himself lost and alone at Paddington Station, he begins to realize that city life is not all he had imagined - until he meets the kindly Brown family, who read the label around his neck ('Please look after this bear. Thank you.') and offer him a temporary haven. It looks as though his luck has changed until this rarest of bears catches the eye of a museum taxidermist...","[{""id"": 10751, ""name"": ""Family""}, {""id"": 35, ""name"": ""Comedy""}]","[{""id"": 392, ""name"": ""england""}, {""id"": 477, ""name"": ""train station""}, {""id"": 818, ""name"": ""based on novel""}, {""id"": 10468, ""name"": ""bear""}, {""id"": 11500, ""name"": ""anthropomorphism""}, {""id"": 167625, ""name"": ""talking to animals""}, {""id"": 170173, ""name"": ""children's book""}]",7.0,883,2014-11-27
300: Rise of an Empire,"Based on Frank Miller's latest graphic novel Xerxes and told in the breathtaking visual style of the blockbuster ""300,"" this new chapter of the epic saga takes the action to a fresh battlefield--on the sea--as Greek general Themistokles attempts to unite all of Greece by leading the charge that will change the course of the war. ""300: Rise of an Empire"" pits Themistokles against the massive invading Persian forces led by mortal-turned-god Xerxes and Artemesia, the vengeful commander of the Persian navy.","[{""id"": 28, ""name"": ""Action""}, {""id"": 10752, ""name"": ""War""}]","[{""id"": 18712, ""name"": ""based on graphic novel""}, {""id"": 162861, ""name"": ""ancient greece""}, {""id"": 179431, ""name"": ""duringcreditsstinger""}, {""id"": 182677, ""name"": ""sea battle""}, {""id"": 188955, ""name"": ""hand to hand combat""}, {""id"": 190999, ""name"": ""minions""}, {""id"": 195862, ""name"": ""naval warfare""}, {""id"": 209714, ""name"": ""3d""}]",6.1,2397,2014-03-05
Escape Plan,"Ray Breslin is the world's foremost authority on structural security. After analyzing every high security prison and learning a vast array of survival skills so he can design escape-proof prisons, his skills are put to the test. He's framed and incarcerated in a master prison he designed himself. He needs to escape and find the person who put him behind bars.","[{""id"": 28, ""name"": ""Action""}, {""id"": 53, ""name"": ""Thriller""}]","[{""id"": 378, ""name"": ""prison""}, {""id"": 789, ""name"": ""muslim""}, {""id"": 3799, ""name"": ""ship""}, {""id"": 10092, ""name"": ""mystery""}, {""id"": 10568, ""name"": ""science fiction""}, {""id"": 10685, ""name"": ""escape""}, {""id"": 14536, ""name"": ""crime""}, {""id"": 156786, ""name"": ""prison escape""}, {""id"": 214596, ""name"": ""cia agent""}]",6.7,1659,2013-10-09
The Legend of Tarzan,"Tarzan, having acclimated to life in London, is called back to his former home in the jungle to investigate the activities at a mining encampment.","[{""id"": 28, ""name"": ""Action""}, {""id"": 12, ""name"": ""Adventure""}]","[{""id"": 409, ""name"": ""africa""}, {""id"": 5650, ""name"": ""feral child""}, {""id"": 7347, ""name"": ""tarzan""}, {""id"": 10787, ""name"": ""jungle""}, {""id"": 158130, ""name"": ""animal attack""}]",5.5,2430,2016-06-29
London Has Fallen,"In London for the Prime Minister's funeral, Mike Banning discovers a plot to assassinate all the attending world leaders.","[{""id"": 28, ""name"": ""Action""}, {""id"": 80, ""name"": ""Crime""}, {""id"": 53, ""name"": ""Thriller""}]","[{""id"": 212, ""name"": ""london england""}, {""id"": 949, ""name"": ""terrorist""}, {""id"": 158774, ""name"": ""terrorist attack""}]",5.8,1621,2016-03-02
Olympus Has Fallen,"When the White House (Secret Service Code: ""Olympus"") is captured by a terrorist mastermind and the President is kidnapped, disgraced former Presidential guard Mike Banning finds himself trapped within the building. As the national security team scrambles to respond, they are forced to rely on Banning's inside knowledge to help retake the White House, save the President and avert an even bigger disaster.","[{""id"": 28, ""name"": ""Action""}, {""id"": 53, ""name"": ""Thriller""}]","[{""id"": 833, ""name"": ""white house""}, {""id"": 41249, ""name"": ""secret service""}, {""id"": 158774, ""name"": ""terrorist attack""}]",6.2,2981,2013-03-20
The Interview,"Dave Skylark and his producer Aaron Rapoport run the celebrity tabloid show ""Skylark Tonight"". When they land an interview with a surprise fan, North Korean dictator Kim Jong-un, they are recruited by the CIA to turn their trip to Pyongyang into an assassination mission.","[{""id"": 28, ""name"": ""Action""}, {""id"": 35, ""name"": ""Comedy""}]","[{""id"": 591, ""name"": ""cia""}, {""id"": 6285, ""name"": ""coup d'etat""}, {""id"": 158538, ""name"": ""north korea""}, {""id"": 191600, ""name"": ""assassination attempt""}, {""id"": 195323, ""name"": ""evil dictator""}]",6.1,2304,2014-12-25
Men in Black 3,"Agents J (Will Smith) and K (Tommy Lee Jones) are back...in time. J has seen some inexplicable things in his 15 years with the Men in Black, but nothing, not even aliens, perplexes him as much as his wry, reticent partner. But when K's life and the fate of the planet are put at stake, Agent J will have to travel back in time to put things right. J discovers that there are secrets to the universe that K never told him - secrets that will reveal themselves as he teams up with the young Agent K (Josh Brolin) to save his partner, the agency, and the future of humankind.","[{""id"": 28, ""name"": ""Action""}, {""id"": 35, ""name"": ""Comedy""}, {""id"": 878, ""name"": ""Science Fiction""}]","[{""id"": 4379, ""name"": ""time travel""}, {""id"": 5455, ""name"": ""time machine""}, {""id"": 9951, ""name"": ""alien""}, {""id"": 174915, ""name"": ""fictional government agency""}, {""id"": 185668, ""name"": ""seeing the future""}, {""id"": 208756, ""name"": ""changing history""}]",6.2,4160,2012-05-23
Ratatouille,"A rat named Remy dreams of becoming a great French chef despite his family's wishes and the obvious problem of being a rat in a decidedly rodent-phobic profession. When fate places Remy in the sewers of Paris, he finds himself ideally situated beneath a restaurant made famous by his culinary hero, Auguste Gusteau. Despite the apparent dangers of being an unlikely - and certainly unwanted - visitor in the kitchen of a fine French restaurant, Remy's passion for cooking soon sets into motion a hilarious and exciting rat race that turns the culinary world of Paris upside down.","[{""id"": 16, ""name"": ""Animation""}, {""id"": 35, ""name"": ""Comedy""}, {""id"": 10751, ""name"": ""Family""}, {""id"": 14, ""name"": ""Fantasy""}]","[{""id"": 90, ""name"": ""paris""}, {""id"": 380, ""name"": ""brother brother relationship""}, {""id"": 996, ""name"": ""expensive restaurant""}, {""id"": 1261, ""name"": ""river""}, {""id"": 1650, ""name"": ""cook""}, {""id"": 2161, ""name"": ""mouse""}, {""id"": 2246, ""name"": ""confidence""}, {""id"": 2405, ""name"": ""roof""}, {""id"": 2872, ""name"": ""window""}, {""id"": 2982, ""name"": ""leaving one's family""}, {""id"": 3640, ""name"": ""work""}, {""id"": 3910, ""name"": ""restaurant critic""}, {""id"": 3914, ""name"": ""kitchen""}, {""id"": 6074, ""name"": ""spice""}, {""id"": 6148, ""name"": ""court""}, {""id"": 6808, ""name"": ""cookbook""}, {""id"": 18035, ""name"": ""family""}, {""id"": 18293, ""name"": ""chef""}, {""id"": 189359, ""name"": ""rat""}]",7.5,4369,2007-06-22
St. Vincent,"A young boy whose parents just divorced finds an unlikely friend and mentor in the misanthropic, bawdy, hedonistic, war veteran who lives next door.","[{""id"": 35, ""name"": ""Comedy""}]","[{""id"": 2604, ""name"": ""babysitter""}, {""id"": 6054, ""name"": ""friendship""}, {""id"": 10226, ""name"": ""neighbor""}, {""id"": 15160, ""name"": ""divorce""}, {""id"": 174085, ""name"": ""child of divorce""}]",7.1,763,2014-10-09
Black Mass,"The true story of Whitey Bulger, the brother of a state senator and the most infamous violent criminal in the history of South Boston, who became an FBI informant to take down a Mafia family invading his turf.","[{""id"": 80, ""name"": ""Crime""}, {""id"": 18, ""name"": ""Drama""}]","[{""id"": 1680, ""name"": ""boston""}, {""id"": 9672, ""name"": ""based on true story""}, {""id"": 10291, ""name"": ""organized crime""}]",6.3,1242,2015-09-04
Slumdog Millionaire,"Jamal Malik is an impoverished Indian teen who becomes a contestant on the Hindi version of ‘Who Wants to Be a Millionaire?’ but, after he wins, he is suspected of cheating.","[{""id"": 18, ""name"": ""Drama""}, {""id"": 10749, ""name"": ""Romance""}]","[{""id"": 100, ""name"": ""slum""}, {""id"": 958, ""name"": ""indian lead""}, {""id"": 1332, ""name"": ""cheating""}, {""id"": 3301, ""name"": ""suspicion""}, {""id"": 4325, ""name"": ""game show""}, {""id"": 13014, ""name"": ""orphan""}, {""id"": 179431, ""name"": ""duringcreditsstinger""}]",7.6,2827,2008-05-12
Hugo,"Hugo is an orphan boy living in the walls of a train station in 1930s Paris. He learned to fix clocks and other gadgets from his father and uncle which he puts to use keeping the train station clocks running. The only thing that he has left that connects him to his dead father is an automaton (mechanical man) that doesn't work without a special key which Hugo needs to find to unlock the secret he believes it contains. On his adventures, he meets with a shopkeeper, George Melies, who works in the train station and his adventure-seeking god-daughter. Hugo finds that they have a surprising connection to his father and the automaton, and he discovers it unlocks some memories the old man has buried inside regarding his past.","[{""id"": 12, ""name"": ""Adventure""}, {""id"": 18, ""name"": ""Drama""}, {""id"": 10751, ""name"": ""Family""}]","[{""id"": 295, ""name"": ""library""}, {""id"": 1507, ""name"": ""clock""}, {""id"": 2793, ""name"": ""film director""}, {""id"": 2849, ""name"": ""key""}, {""id"": 4290, ""name"": ""toy""}, {""id"": 5202, ""name"": ""boy""}, {""id"": 9673, ""name"": ""love""}, {""id"": 13014, ""name"": ""orphan""}, {""id"": 14544, ""name"": ""robot""}, {""id"": 14545, ""name"": ""automaton""}, {""id"": 18028, ""name"": ""hiding""}, {""id"": 33490, ""name"": ""filmmaking""}, {""id"": 41372, ""name"": ""leg brace""}, {""id"": 156149, ""name"": ""doberman""}, {""id"": 209714, ""name"": ""3d""}]",7.0,2141,2011-11-22
Taken 3,"Ex-government operative Bryan Mills finds his life is shattered when he's falsely accused of a murder that hits close to home. As he's pursued by a savvy police inspector, Mills employs his particular set of skills to track the real killer and exact his unique brand of justice.","[{""id"": 53, ""name"": ""Thriller""}, {""id"": 28, ""name"": ""Action""}]","[{""id"": 9748, ""name"": ""revenge""}, {""id"": 9826, ""name"": ""murder""}, {""id"": 10562, ""name"": ""on the run""}, {""id"": 10718, ""name"": ""fugitive""}, {""id"": 15124, ""name"": ""framed""}, {""id"": 15300, ""name"": ""father daughter relationship""}, {""id"": 180172, ""name"": ""framed for murder""}]",6.1,2200,2014-12-16
